NOMBRE_CONJUNTO;TIPO_BIEN;PRECIO;LOCALIZACIÓN;FECHA_PUBLICACIÓN;ÁREA m²;NUM_HABITACIONES;NOMBRE_PROYECTO
Casa Terreno De Venta Sector Conocoto Ontaneda;Casa; 249990;Conocoto, Valle Los Chillos;19/marzo/2020;;;
Casa En Venta 250m2. 3 Dormitorios Yanazarapata Cumbayá;Casa; 235000;Cumbaya, Valle Tumbaco;10/marzo/2020;;;
Venta O Arriendo De Casa Rentera Con Locales Comerciales Sector Plaza Fosch.;Casa; 320000;Mariscal Sucre, Centro Norte;10/marzo/2020;;;
Casa En Conjunto Sector Pomasqui;Casa; 89000;Pomasqui, Norte De Quito;10/marzo/2020;;;
Casa De Venta Sector Pomasqui, Junto Al Centro De Exposiciones Cemexpo, Viña De Pomasqui;Casa; 109000;Pomasqui, Norte De Quito;10/marzo/2020;;;
Vendo Departamento 3 Dormitorios - El Bosque;Departamentos; 130000;Quito Tenis, Centro Norte;20/marzo/2020;;;
Casa Venta Auquichico Oportunidad;Casa; 580000;Cumbaya, Valle Tumbaco;10/marzo/2020;;;
Venta Suite Monteserrin / Frente Ecopark / Amoblada O Sin Amoblar;Departamentos; 115000;Cumbaya, Valle Tumbaco;10/marzo/2020;;;
Cumbayá Hermosa Casa De Venta 4 Dormitorios 350mts2.;Casa; 350000;Granda Centeno, Rumipamba, Centro Norte;10/marzo/2020;;;
Oficinas En Renta- Sector Ministerio Del Deporte-880m2 Mas 17 Parqueaderos-7500 Negociables;Casa; 7500;Jipijapa, Centro Norte;10/marzo/2020;;;
Hermoso Departamento De Venta - Sector Batan Bajo - Tres Dormitorios;Departamentos; 155000;Iñaquito, Centro Norte;10/marzo/2020;;;
Venta Casa Ponceano/Estadio Liga/Norte;Casa; 155000;Ponceano, Norte De Quito;10/marzo/2020;;;
Departamento Venta / 6 De Diciembre;Departamentos; 80000;Kennedy, Centro Norte;10/marzo/2020;;;
Espectacular Casa De Venta Por Estrenar De 3 Habitaciones;Casa; 318000;Tumbaco, Valle Tumbaco;10/marzo/2020;;;
Departamento 3 Dormitorios De Venta En Monteserrín, Eloy Alfaro;Departamentos; 69000;Monteserrin, Jipijapa, Centro Norte;10/marzo/2020;;;
Casa De Venta De Oportunidad Ponceano Alto;Casa; 124000;Ponceano, Norte De Quito;10/marzo/2020;;;
Vendo Casa Pakakuna Gardens - Checa;Casa; 209000;Checa, Valle Tumbaco;10/marzo/2020;;;
Venta Departamento Terraza Vista Tennis;Departamentos; 265000;Rumipamba, Centro Norte;18/marzo/2020;;;
Vendo Casa Rentera En Elcomité Del Pueblo;Casa; 90000;Comité Del Pueblo, Centro Norte;10/marzo/2020;;;
Departamento De Venta En Conocoto;Departamentos; 57500;Conocoto, Valle Los Chillos;16/marzo/2020;;;
Casa En Venta De 260m Sector Nayon;Casa; 340000;Nayon - Tanda, Valle Tumbaco;10/marzo/2020;;;
Lindos Departamentos En El Pinar;Departamentos; 122000;Concepción, Centro Norte;20/marzo/2020;;;
Se Vende Departamento Con Vista, En Av. Portugal, Cerca Parque La Carolina Y Quicentro Shopping;Departamentos; 175000;Iñaquito, Centro Norte;10/marzo/2020;;;
Vendo Departamento Remodelado En Conjunto. Sur Quito - El Beaterio;Departamentos; 39500;Turubamba, Sur De Quito;10/marzo/2020;;;
Departamento Venta Condado, Nuevo, 3 Dorm, Full, Norte De Quito, Par;Departamentos; 88000;El Condado, Norte De Quito;10/marzo/2020;;;
Se Vende Dpto, El Bosque;Departamentos; 300000;San Isidro Del Inca, Centro Norte;10/marzo/2020;;;
Casa En La Armenia Conjunto Prados De La Armenia;Casa; 118990;Conocoto, Valle Los Chillos;10/marzo/2020;;;
Venta Departamento 3 Dormitorios / Gonzalez Suarez / Coruña / Centro Norte;Departamentos; 219000;Gonzalez Suarez, Iñaquito, Centro Norte;10/marzo/2020;;;
Venta Amplia Casa De 5 Dormitorios Urbanización Ute Sector Calderón;Casa; 200000;Calderón, Norte De Quito;10/marzo/2020;;;
Venta De Departamwnto Urbanizacion Jaridnes De Amagasi;Departamentos; 138000;San Isidro Del Inca, Centro Norte;10/marzo/2020;;;
Se Vende Departamento 3 Dormitorios - Monteserrin - Norte De Quito;Departamentos; 169900;Monteserrin, Jipijapa, Centro Norte;10/marzo/2020;;;
Venta Casa Amplia En Sur De Quito, Sector La Gatazo, Esquinera, Incluye Local Comercial;Casa; 140000;San Bartolo, Sur De Quito;10/marzo/2020;;;
Linda Casa A Estrenar En Tumbaco Cerca A La Ruta Viva;Casa; 139900;Tumbaco, Valle Tumbaco;10/marzo/2020;;;
Departamento De Venta Jardínes Del Batán 2 Dormitorios;Departamentos; 145000;Jipijapa, Centro Norte;10/marzo/2020;;;
Venta Hotel Colonial Lujo Espejo Centro Teatro Bolivar;Casa; 1698990;Centro De Quito, Centro Colonial;10/marzo/2020;;;
En Venta Hermoso Departamento Quito Tenis Cabildos Park Excelente Ubicacion Vista Panorámica;Departamentos; 320000;Rumipamba, Centro Norte;10/marzo/2020;;;
Hermosa Casa De Venta , Sector Carcelén - Einsten;Casa; 190000;Carcelen, Norte De Quito;10/marzo/2020;;;
Sector Carcelen Comodo Departamento Tres Dormitorios, 82 Mts., Conjunto Cerrado, Areas Verdes;Departamentos; 78000;Carcelen, Norte De Quito;19/marzo/2020;;;
Vendo, Venta De Casa Sector Norte De Quito, Ponceano.;Casa; 111000;La Merced, Valle Los Chillos;12/marzo/2020;;;
Venta Amplio Y Hermoso Departamento 217m2 Jardines Del Batan Más Terraza De 200m2;Departamentos; 279000;Iñaquito, Centro Norte;10/marzo/2020;;;
Venta Departamento De 3 Dormitorios Sector Eloy Alfaro, Clínica Pasteur, Centro Norte;Departamentos; 110000;Iñaquito, Centro Norte;10/marzo/2020;;;
Vendo Departamento 97mts2, 2 Dormitorios, Balcòn Sector Republica Del Salvador, Piscina;Departamentos; 176000;Iñaquito, Centro Norte;10/marzo/2020;;;
Venta,Departamentos 3d, Conjunto Mont Blanc, Crédito Vip, En Sta.Mónica De Conocoto;Departamentos; 265000;Conocoto, Valle Los Chillos;03/abril/2020;;;
Venta O Arriendo Dpto La Brasil;Departamentos; 230000;Rumipamba, Centro Norte;24/marzo/2020;;;
Vendo Hermosa Casa Av. Occidental Lugar Exclusivo;Casa; 95000;Belisario Quevedo, Centro Norte;10/marzo/2020;;;
Hermosa Casa 4 Dormitorios 5 Baños 4 Garage Bodega Estudio Porche Sector Amagasi;Casa; 339800;San Isidro Del Inca, Centro Norte;10/marzo/2020;;;
Hermoso Depart Por Estrenar Monteserrin Bajo;Departamentos; 128000;Monteserrin, Jipijapa, Centro Norte;10/marzo/2020;;;
Vendo Exclusivo Penthouse En Suiza Y Eloy Alfaro;Departamentos; 330000;Iñaquito, Centro Norte;05/abril/2020;;;
Departamento A Estrenar 3 Dormitorios En Venta - Av. Orellana - Centro Norte Quito;Departamentos; 164927;Mariscal Sucre, Centro Norte;27/marzo/2020;;;
Amplia Casa Con Gran Terreno Al Sur De Quito;Casa; 165000;Quitumbe, Sur De Quito;10/marzo/2020;;;
Vendo Casa Rentera Esquinera Kennedy 588 M²;Casa; 500000;Kennedy, Centro Norte;31/marzo/2020;;;
En Venta Hermosa Suite (11vo Piso), En La Bosmediano;Departamentos; 81000;Bellavista, Iñaquito, Centro Norte;10/marzo/2020;;;
Casa De Venta En Zabala Bajo, Norte De Quito;Casa; 85000;Calderón, Norte De Quito;10/marzo/2020;;;
Casa De Venta Por Terminar, Los Chillos, La Espe. Terreno 450 M2;Casa; 125000;Quito;10/marzo/2020;;;
Suites En La Carolina Edificio Epiq Sd5;Departamentos; 140659;Iñaquito, Centro Norte;01/abril/2020;;;
Departamento Dos Hemisferios, 3 Dormitorios, Primer Piso, Con Mejora, Lámparas,Cortinas,Piso Flotante $62.000 Negociable;Departamentos; 62000;Pomasqui, Norte De Quito;16/marzo/2020;;;
Amplio, Comodo Y Bonito Departamento En Venta Sector San Fernando;Departamentos; 85000;Cochapamba, Centro Norte;12/marzo/2020;;;
Casa De Venta En Calderon, Vía Marianitas, Llano Grande, Chico,Carapungo, Ism Calderon;Casa; 72000;Calderón, Norte De Quito;06/abril/2020;;;
Venta De Departamento De 105m² Granda Centeno, Quito;Departamentos; 149000;Granda Centeno, Rumipamba, Centro Norte;11/marzo/2020;;;
Casas De 85 Metros Credito Vip Al 4,99% En Calderon Marianitas;Departamentos; 74990;Calderón, Norte De Quito;10/marzo/2020;;;
Casas En Venta En Calderón;Casa; 81500;Calderón, Norte De Quito;07/04/2020;;;
Vendo Departamento 2 Dormitorios, 90 M2, República Del Salvador, Parque La Carolina;Departamentos; 123000;Iñaquito, Centro Norte;24/marzo/2020;;;
Casa De Venta En Quito Tenis, A Unos 5 Minutos Del Cc El Bosque Norte De Quito;Casa; 1800;Rumipamba, Centro Norte;20/marzo/2020;;;
Venta Departamento Mitad Del Mundo;Departamentos; 50000;San Antonio De Pichincha, Norte De Quito;07/04/2020;;;
Se Vende, Casa, En Tumbaco, Pocos Metros De La Ruta Viva;Casa; 320000;Tumbaco, Valle Tumbaco;05/abril/2020;;;
Venta Departamento En Tumbaco Cerca De Av. Interoceanica Y Ruta Viva, Sector Ruta Viva;Departamentos; 140000;Tumbaco, Valle Tumbaco;06/abril/2020;;;
Casa De Venta Dentro De Conjunto Privado Entumbaco;Casa; 148000;Tumbaco, Valle Tumbaco;05/abril/2020;;;
Vendo Casa En Calderon A Estrenar 85.000 Dolares Sector Marianitas;Casa; 85000;Calderón, Norte De Quito;27/marzo/2020;;;
Venta Casa, 222,39m², 3 Dormitorios, Cumbayá;Casa; 299000;Cumbaya, Valle Tumbaco;30/marzo/2020;;;
Vendo Casa En Conjunto En San Juan De Cumbayá;Casa; 138000;Cumbaya, Valle Tumbaco;04/abril/2020;;;
Vendo Departamento Para Inversion Sector Gonzalez Suarez;Departamentos; 220000;Gonzalez Suarez, Iñaquito, Centro Norte;10/marzo/2020;;;
Casa De Venta Colinas Del Pichincha;Casa; 270000;Quito Tenis, Centro Norte;22/marzo/2020;;;
Vendo Hermosa Suite Por Estrenar Los Laureles - Monteserrín;Departamentos; 79000;Jipijapa, Centro Norte;01/abril/2020;;;
Al Mejor Precio! Hermosa Casa Dentro De Conjunto!;Casa; 244263;Tumbaco, Valle Tumbaco;10/marzo/2020;;;
Venta De Hermosa Casa En Él Valles De Los Chillo;Casa; 130000;Chimbacalle, Sur De Quito;10/marzo/2020;;;
Venta Casa, Sector Quitumbe;Casa; 63000;Quitumbe, Sur De Quito;19/marzo/2020;;;
Venta Departamento Pomasqui;Departamentos; 69000;Pomasqui, Norte De Quito;30/marzo/2020;;;
Amplio Departamento En Venta, Espectacular Vista, 4 Dormitorios, Quito Tenis;Departamentos; 295000;Cochapamba, Centro Norte;01/abril/2020;;;
Oportunidad Venta Departamento Duplex San Blas Centro De Quito Remodelado;Departamentos; 60000;Centro De Quito, Centro Colonial;01/abril/2020;;;
Casa De Venta En Tumbaco;Casa; 150000;Tumbaco, Valle Tumbaco;20/marzo/2020;;;
Venta Departamento Urb. El Condado;Departamentos; 88900;El Condado, Norte De Quito;13/marzo/2020;;;
Departamento En La Carolina;Departamentos; 162500;Iñaquito, Centro Norte;13/marzo/2020;;;
Vendo Linda Casa, Miravalle 1. 4 Dormitorios.;Casa; 380000;Miravalle, Nayon - Tanda, Valle Tumbaco;17/marzo/2020;;;
Suite Con Patio En El Quito Tenis De Venta;Departamentos; 109000;Rumipamba, Centro Norte;29/marzo/2020;;;
Casa En Venta, Sector San Jose De Jarrín, Cotocollao, Cerca Al Colegio Mena Del Hierro, Norte De Quito;Casa; 94000;Cotocollao, Norte De Quito;31/marzo/2020;;;
Sn Patricio Cumbaya Venta Urgente Ayudamos En El Financiamiento;Casa; 380000;Cumbaya, Valle Tumbaco;10/marzo/2020;;;
Casa En Carapungo Cerca Parqueadero Juan Montalvo Amplia Y Cuatro Dormitorios;Casa; 125000;Carapungo, Calderón, Norte De Quito;10/marzo/2020;;;
Vendo Departamento En Condominios Jardines De California;Departamentos; 48000;Kennedy, Centro Norte;16/marzo/2020;;;
Venta Departamento Tres Habitaciones Nuevo A Estrenar Amplio Cerca Centro Comercial Plaza Real “Calderón” $75.000;Departamentos; 75000;Calderón, Norte De Quito;27/marzo/2020;;;
Zamora Y Brasil Suite Con Patio $66.000;Departamentos; 66000;Rumipamba, Centro Norte;10/marzo/2020;;;
Centro Norte, Sector Universidad Católica Suite En Venta;Departamentos; 79336;Mariscal Sucre, Centro Norte;12/marzo/2020;;;
Departamento En Calderón - Sector Colegio Del Milenio - Si Aplica A Crèdito Vip - Si Venezolanos, Extranjeros Y Nacional;Departamentos; 43990;Calderón, Norte De Quito;26/marzo/2020;;;
Casa Nueva En Venta Al Sur De Quito Sector Martha Bucaram;Casa; 91000;La Ecuatoriana, Sur De Quito;26/marzo/2020;;;
Departamento En Venta. Sector La Floresta. Negociable.;Departamentos; 149000;Mariscal Sucre, Centro Norte;24/marzo/2020;;;
González Suárez, Estrene Departamento De Venta;Departamentos; 220000;Gonzalez Suarez, Iñaquito, Centro Norte;10/marzo/2020;;;
Departamento En Venta 3 Dormitorios, Norte De Quito, Avenida Occidental, Antigua Jefatura De Tránsitoo;Departamentos; 48000;Cochapamba, Centro Norte;23/marzo/2020;;;
Financiamos El 100% Casa Por Estrenar - Mitad Del Mundo;Casa; 99990;San Antonio De Pichincha, Norte De Quito;23/marzo/2020;;;
Venta De Espectacular Suite Con Parqueadero En Un Edificio Inteligente De 24 Pisos, En La República Del Salvador;Departamentos; 146929;Iñaquito, Centro Norte;23/marzo/2020;;;
Casas De Venta En Lindo Conjunto Yaruqui;Casa; 44300;Yaruqui, Valle Tumbaco;10/marzo/2020;;;
Casa En Venta Sector Cotocollao, Av. La Prensa, Lizardo Ruiz, Libertador Quito Pichincha;Casa; 300000;Cotocollao, Norte De Quito;10/marzo/2020;;;
Venta Lindo Departamento 2 Dorm Altos De La Armenia 1 - Conocoto;Departamentos; 159000;Conocoto, Valle Los Chillos;16/marzo/2020;;;
Casa De Venta Sur De Quito Cerca A La Marical Sucre;Casa; 80000;Guamaní, Sur De Quito;10/marzo/2020;;;
Vendo Studios - Desde 26m2 - Con / Sin Parqueadero - Excelentes Áreas Comunales - El Batán;Departamentos; 39995;Iñaquito, Centro Norte;10/marzo/2020;;;
Casa Esquinera En Venta La Primavera (Cumbayá) Piscina, Sala De Juegos;Casa; 500000;Cumbaya, Valle Tumbaco;10/marzo/2020;;;
Venta Departamentos Por Estrenar - 3 Habitaciones - 23 De Junio;Departamentos; 80000;Cotocollao, Norte De Quito;19/marzo/2020;;;
Apartamento De Venta Conjunto Roca Azul, Santa Lucia;Departamentos; 115000;Comité Del Pueblo, Centro Norte;19/marzo/2020;;;
Casa De Venta En San Antonio De Pichincha, Mitad Del Mundo, Norte De Quito, Zona Equinoccial, Cemexpo;Casa; 84000;San Antonio De Pichincha, Norte De Quito;10/marzo/2020;;;
Venta De Departamento Sector Lomas De Monteserrín Cerca Al Ecopark;Departamentos; 160000;Monteserrin, Jipijapa, Centro Norte;10/marzo/2020;;;
Venta Departamentos A Estrenar Urbanización El Condado;Departamentos; 159626;El Condado, Norte De Quito;10/marzo/2020;;;
Exclusiva Casa Lomas De Cumbaya 564 Mts Totalmente Remodelada;Casa; 517000;Tumbaco, Valle Tumbaco;18/marzo/2020;;;
Venta Departamento 3 Habitaciones,Sector Colegios Sek, Martin Cerere;Departamentos; 79000;Cumbaya, Valle Tumbaco;16/marzo/2020;;;
Venta Casa En Conjunto 90m2 Sector Cotocollao;Casa; 110000;Cotocollao, Norte De Quito;16/marzo/2020;;;
Departamento Venta Av. De Los Granados, Centro Norte De Quito;Departamentos; 154000;El Inca, Jipijapa, Centro Norte;10/marzo/2020;;;
Venta Casa Amplia, En Conjunto. Av Plaza Lasso Y Bellavista, Iglesia Divino Niño;Casa; 110000;Ponceano, Norte De Quito;10/marzo/2020;;;
Acogedor Departamento De Venta 98 M² Sector Monteserrín. / A. C;Departamentos; 99000;Monteserrin, Jipijapa, Centro Norte;10/marzo/2020;;;
Venta De Casa En Cumbaya;Casa; 290000;Cumbaya, Valle Tumbaco;10/marzo/2020;;;
Vendo Hermoso Departamento Urb El Condado;Departamentos; 150000;Cotocollao, Norte De Quito;10/marzo/2020;;;
Venta Casa Rentera Capelo;Casa; 219900;Quito;10/marzo/2020;;;
Venta De Casa En Nayón, Calle Tacuri, Norte De Quito;Casa; 399000;Nayon - Tanda, Valle Tumbaco;13/marzo/2020;;;
Casa De Venta En Santa Bárbara De Chillogallo, Sur De Quito;Casa; 58000;La Mena, Sur De Quito;12/marzo/2020;;;
Departamento Venta 363 M2 Colinas Del Pichincha / El Bosque / Granda Centeno, 3 Dormitorios, Terraza 100 M2, Quito Norte;Departamentos; 265000;Rumipamba, Centro Norte;10/marzo/2020;;;
Amplio Departamento Ubicado En Ciudadela Chiriacu De Monjas, La Ferroviaria;Departamentos; 50000;La Ferroviaria, Sur De Quito;10/marzo/2020;;;
Ponceano Alto - Departamento En Venta Precio A Negociar;Departamentos; 118500;Ponceano, Norte De Quito;10/marzo/2020;;;
Venta Casa Ciudadela Atahualpa, Sur De Quito, Atrás De La Tribuna Del Sur;Casa; 106000;La Magdalena, Sur De Quito;10/marzo/2020;;;
Vendo Departamento Duplex, Sector La Isla, Universidad Central, 198m2;Departamentos; 130000;Belisario Quevedo, Centro Norte;11/marzo/2020;;;
Vendo Casa Nueva Parque La Moya En Conjunto /Valle De Los Chillos;Casa; 115000;Conocoto, Valle Los Chillos;10/marzo/2020;;;
De Oportunidad, Hermosa Y Amplia Casa De Venta Sector La Armenia;Casa; 260000;La Armenia I, Conocoto, Valle Los Chillos;10/marzo/2020;;;
Departamento Venta Cumbaya;Departamentos; 276599;Cumbaya, Valle Tumbaco;10/marzo/2020;;;
Vendo Departamento, Granda Centeno 187 M², Dos Habitaciones Nuevo Lujo, $33000;Departamentos; 330000;Rumipamba, Centro Norte;10/marzo/2020;;;
Venta Departamento 2 P 11 La Carolina;Casa; 138000;Iñaquito, Centro Norte;10/marzo/2020;;;
Casas Conocoto La Salle;Casa; 94900;Conocoto, Valle Los Chillos;10/marzo/2020;;;
Casas A Estrenar En Venta Dentro De Conjunto Privado En Capelo–Valle De Los Chillos–Sector Sangolquí Cerca De San Rafael;Casa; 85000;Quito;10/marzo/2020;;;
Departamento, Vista Panorámica, Jardines Del Batán;Departamentos; 270000;Iñaquito, Centro Norte;10/marzo/2020;;;
Casa De Venta, Sangolqui, Bohios Jatumpamba;Casa; 228000;Sangolqui, Valle Los Chillos;09/marzo/2020;;;
Venta Casa Grande Rentera En Remodelacion Al Centro Sur De Quito, Sector San Diego, Con Dos Frentes, Con Local Comercia;Casa; 140000;Centro De Quito, Centro Colonial;10/marzo/2020;;;
Venta Suite En El Edificio Athelier Perfecta Para Inversión, Centro Norte, Uio;Departamentos; 100000;Iñaquito, Centro Norte;10/marzo/2020;;;
Mirasierra-Valle De Los Chillos Departamento 2 Dormitorios Por Estrenar En Venta;Departamentos; 90832;Alangasí, Valle Los Chillos;10/marzo/2020;;;
Nayon, Departamento Con Jardín De Venta, En Conjunto Cerrado Con Seguridad;Departamentos; 165000;Nayon - Tanda, Valle Tumbaco;10/marzo/2020;;;
Departamento Moderno De Lujo En Santa Lucia Alta, Cumbaya, De 3 Dormitorios Con Pergola Y Jacuzzi;Departamentos; 595000;Cumbaya, Valle Tumbaco;10/marzo/2020;;;
Venta De Casa Independiente Urb. Coopedac Aplica 6.99 % Biess Valle De Los Chillos;Casa; 129000;Quito;10/marzo/2020;;;
Departamento En La Vasco De Contreras, Cerca Al Colegio San Gabriel – Plaza De Las Americas;Departamentos; 116870;Rumipamba, Centro Norte;10/marzo/2020;;;
Casas De 4 Dorm. En Venta Con 2 Amplios Master Walking Closet Y Baño Privado, Capelo;Casa; 149000;Quito;10/marzo/2020;;;
Hermoso Departamento Cerca. De La Udla;Departamentos; 72000;Chillogallo, Sur De Quito;10/marzo/2020;;;
Hermosa Casa Sector Parque Metropolitano De La Armenia;Casa; 89000;Conocoto, Valle Los Chillos;10/marzo/2020;;;
Casa En Venta / Cumbaya (La Primavera);Casa; 2300000;Cumbaya, Valle Tumbaco;10/marzo/2020;;;
Casa Rentera Vendo - Hospital Metropolitanoitano;Casa; 310000;Belisario Quevedo, Centro Norte;10/marzo/2020;;;
Hermoso Dpto Duplex En Cumbaya;Departamentos; 240000;Cumbaya, Valle Tumbaco;10/marzo/2020;;;
Departamento En Venta;Departamentos; 116500;La Luz, Kennedy, Centro Norte;10/marzo/2020;;;
Venta Suite Parque Metropolitano;Departamentos; 69000;Iñaquito, Centro Norte;10/marzo/2020;;;
San Sebastian De Calderon 2;Casa; 48500;Calderón, Norte De Quito;10/marzo/2020;;;
Casa Rentera De Venta Sur De Quito. Diagonal A La Parada Del Corredor Sur La Santiago;Casa; 155000;San Bartolo, Sur De Quito;10/marzo/2020;;;
Venta Departamento Duplex 3 Habitaciones, Cumbaya;Departamentos; 359000;Cumbaya, Valle Tumbaco;07/04/2020;;;
Cerca Al Jardin;Departamentos; 165000;Iñaquito, Centro Norte;10/marzo/2020;;;
Venta Departamento Amagasi Del Inca Quito, Pichincha;Departamentos; 160000;San Isidro Del Inca, Centro Norte;10/marzo/2020;;;
Venta Departamento Sector Centro Norte;Departamentos; 140000;El Inca, Jipijapa, Centro Norte;10/marzo/2020;;;
Ontaneda. $218.000. Vendo Casa. 2 Plantas. Conocoto.;Casa; 218000;Iñaquito, Centro Norte;10/marzo/2020;;;
Venta De Casa Sector Calderón;Casa; 100728;Calderón, Norte De Quito;10/marzo/2020;;;
Loft En Venta En El Sector De La Coruña Por Estrenar;Departamentos; 113360;Iñaquito, Centro Norte;07/04/2020;;;
Venta Suite Sector La Carolina CCI $93,000 - Wasi;Casa; 93000;Iñaquito, Centro Norte;26/marzo/2020;;;
Mariano Pozo 56;Departamentos; 130000
            $80 alicuota;Ponceano, Norte De Quito;31/marzo/2020;;;
249 - Departamento De Venta Tumbaco 3 Dorm Sector La Morita Ruta Viva, Fácil Salida A Puembo, Cumbayá, Los Chillos;Departamentos; 188000;Tumbaco, Valle Tumbaco;10/marzo/2020;;;
Departamento Penthouse En Venta, Quito Tenis De Oportunidad;Departamentos; 267000;Rumipamba, Centro Norte;13/marzo/2020;;;
Venta Departamento Sector El Batán A Estrenar;Departamentos; 219239;Jipijapa, Centro Norte;06/abril/2020;;;
Av. República Del Salvador 123;Departamentos; 152000
            $210 alicuota;La Carolina, Iñaquito, Centro Norte;06/noviembre/2019;;;
Casa Amplia Rentera Para Remodelacion;Casa; 135000;San Juan, Centro Colonial;10/marzo/2020;;;
Departamento A La Venta, Urb.El Condado, 123 Mts 2;Departamentos; 140000;Cotocollao, Norte De Quito;03/abril/2020;;;
Departamento En Quito, Pinar Bajo, Venta, Por Estrenar, 2 Dormitorios;Departamentos; 120000;El Pinar, Concepción, Centro Norte;06/abril/2020;83;2;
Casa De Venta Por Estrenar Sector Urabá 3 Dormitorios;Casa; 117000;Comité Del Pueblo, Centro Norte;06/abril/2020;;;
Venta Departamentos Urb. El Condado 2 Y 3 Dormitorios;Departamentos; 249000;Iñaquito, Centro Norte;01/abril/2020;;;
Excelente Suite En Venta En Centro Norte De Quito Granda Centeno;Departamentos; 92000;Granda Centeno, Rumipamba, Centro Norte;27/marzo/2020;;;
C/ Carcelén Bajo! Hermoso Departamento De 92m2 En Venta!! A Estrenar!!;Departamentos; 90000;Carcelen, Norte De Quito;07/04/2020;;;
Cumbaya Casa De Venta En Urbanizacion Privada;Casa; 1150000;Cumbaya, Valle Tumbaco;04/abril/2020;;;
Departamento De Venta, 3 Dormitorios, Sector Solca, Jardines De Amagasi, Norte De Quito;Departamentos; 210000;San Isidro Del Inca, Centro Norte;13/marzo/2020;;;
406 Quito Tenis. Vendo Departamento 82,41 M 2 Dormitorios. A Estrenar;Departamentos; 148000;Rumipamba, Centro Norte;04/abril/2020;;;
Departamento De 3 Dormitorios, Embajada Americana, Centro Norte;Departamentos; 168000;Kennedy, Centro Norte;24/marzo/2020;;;
Departamento De Venta En Ponceano, Cerca Supermaxi;Departamentos; 160000;Ponceano, Norte De Quito;03/abril/2020;;;
Amplio Terreno Con Casa De Venta Sector San José De Cutuglagua;Casa; 45500;Guamaní, Sur De Quito;17/marzo/2020;;;
Casa De Venta La Viña, Moderna, Elegante, Casa 400 Mts, Área Social A Doble Altura, Chimenea Exterior, Bbq.;Casa; 600000;Cumbaya, Valle Tumbaco;10/marzo/2020;;;
Carolina Vendo Suit Con Vista Nueva Con Piscina;Departamentos; 110000;La Carolina, Iñaquito, Centro Norte;10/marzo/2020;;;
Venta De Hermosa Casa Sector Amagasí Del Inca, Embajada Americana;Casa; 138000;San Isidro Del Inca, Centro Norte;31/marzo/2020;;;
Venta De Casa De Tres Pisos Sector – Puente 3;Casa; 131700;Conocoto, Valle Los Chillos;16/marzo/2020;;;
Venta Departamento 3 Dormitorios En San Carlos / Norte De Quito;Departamentos; 43000;San Carlos, Concepción, Centro Norte;10/marzo/2020;;;
Vendo Casa. Norte De Quito Ponceano 4 Habitaciones;Casa; 130000;Ponceano, Norte De Quito;10/marzo/2020;;;
Se Vende Cálida Y Luminosa Suite;Departamentos; 67250;Cotocollao, Norte De Quito;30/marzo/2020;;;
Casa De Venta Sector San Juan Bajo De Cumbaya;Casa; 279900;Cumbaya, Valle Tumbaco;30/marzo/2020;;;
Venta Bonita Casa - Lumbisí;Casa; 300000;Guangopolo, Valle Los Chillos;13/marzo/2020;;;
Casa Remodelada 3 Dorm. 2 Parq. Sector Solca;Casa; 137000;Kennedy, Centro Norte;17/marzo/2020;;;
Venta De Casa En La Armenia, Valle De Los Chillos Oportunidad De Inversión;Casa; 299000;Conocoto, Valle Los Chillos;10/marzo/2020;;;
Venta Departamento Sector Estadio Olímpico – 93 M2;Departamentos; 110000;Iñaquito, Centro Norte;29/marzo/2020;;;
Venta Amplia Casa Espe 3 Dormitorios Valle Quito Sangolqui;Casa; 87000;Quito;28/marzo/2020;;;
Departamento En Venta Sector El Batan Cerca Al Estadio Olimpico Y Al Parque Metropolitano;Departamentos; 158000;Iñaquito, Centro Norte;19/marzo/2020;;;
Venta Casa, Sector Colegio Alberth Einsten, Carcelen, Norte De Quito;Casa; 210000;Carcelen, Norte De Quito;27/marzo/2020;;;
Vendo Propiedad Independiente, Esquinera, Mirasierra, 2.116m2 De Terreno400000;Casa; 420000;Alangasí, Valle Los Chillos;23/marzo/2020;;;
Vendo Departamento Quiteño Libre 285000;Departamentos; 285000;Bellavista, Iñaquito, Centro Norte;19/marzo/2020;;;
Departamento De Venta En Quito En El Pinar Alto La Occidental Cod: V060;Departamentos; 93000;El Pinar, Concepción, Centro Norte;25/marzo/2020;;;
Venta O Renta Departamento 3 Hab 4 Baños (141 M²) 2 Parqueaderos Av González Suárez;Departamentos; 135000;Iñaquito, Centro Norte;24/marzo/2020;;;
Casa De Venta En Cumbayá;Casa; 1200000;Cumbaya, Valle Tumbaco;23/marzo/2020;;;
Venta Casa Miravalle 4, Cumbaya;Casa; 298000;Miravalle, Nayon - Tanda, Valle Tumbaco;23/marzo/2020;;;
Venta De Casa En La Argelia, Sur De Quito, Oriental, Av. Simon Bolivar;Casa; 105000;La Argelia, Sur De Quito;23/marzo/2020;;;
Casa En Venta Quito/ Carcelen/ Norte De Quito 90% Biess;Casa; 134990;Carcelen, Norte De Quito;22/marzo/2020;;;
Checa Casa Quinta De Venta 13.100 Metros Yaruqui;Casa; 640000;Checa, Valle Tumbaco;27/marzo/2020;;;
Casa De Venta De Dos Departamentos Independiente En Labrador 408 M2 Habitables. 540 M2 Totales.;Casa; 199500;Concepción, Centro Norte;10/marzo/2020;;;
Vendo Casa Por Estrenar Sector La Salle / Valle De Los Chillos;Casa; 78900;Amaguaña, Sur De Quito;13/marzo/2020;;;
Casa De Venta En Cumbaya;Casa; 149000;Cumbaya, Valle Tumbaco;04/abril/2020;;;
Venta Suite A Estrenar Amoblada Sector La Carolina;Departamentos; 114200;Iñaquito, Centro Norte;27/marzo/2020;;;
Se Vende Casa En San Juan De Calderón;Casa; 49637;Calderón, Norte De Quito;10/marzo/2020;;;
Casa De 3 Pisos En Venta En Conjunto, En Calderón, Quito.;Casa; 63000;Calderón, Norte De Quito;17/marzo/2020;;;
Venta De Departamentos San Carlos Alto, Norte De Quito;Departamentos; 75000;Ponceano, Norte De Quito;10/marzo/2020;;;
El Bosque De Venta Hermoso Departamento;Departamentos; 270000;Cochapamba, Centro Norte;31/marzo/2020;;;
En Venta Suite República Del Salvador;Departamentos; 109000;Iñaquito, Centro Norte;18/marzo/2020;;;
Vendo Hermoso Departamento Con Vista Privilegiada;Departamentos; 98000;San Isidro Del Inca, Centro Norte;10/marzo/2020;;;
