NOMBRE_CONJUNTO;TIPO_BIEN;PRECIO;LOCALIZACIÓN;FECHA_PUBLICACIÓN;ÁREA m²;NUM_HABITACIONES;NOMBRE_PROYECTO
Departamento En Venta Sector Bellavista. Negociable;Departamentos; 289000;Iñaquito, Centro Norte;25/marzo/2020;;;
Yaruqui, Sector Otompe Veloz Hermosa Finca 32.600 M2;Casa; 650000;Yaruqui, Valle Tumbaco;24/marzo/2020;;;
Departamento De Venta, Sector El Bosque, Norte De Quito, Penthouse Con Hermosa Vista;Departamentos; 195000;Quito Tenis, Centro Norte;24/marzo/2020;;;
Casa De 117 En Llano Grande;Casa; 74000;Calderón, Norte De Quito;24/marzo/2020;;;
Casa De Oportunidad En Manta;Casa; 245000;Iñaquito, Centro Norte;24/marzo/2020;;;
Be/ El Recreo - Se Vende Hermosa Casa 500 M2 Cod. Ca - 00104;Casa; 298000;San Bartolo, Sur De Quito;23/marzo/2020;;;
Casa Oportunidad Venta Auquichico;Casa; 580000;Cumbaya, Valle Tumbaco;23/marzo/2020;;;
Vendo Casa 340 M Sector El Bosque;Casa; 270000;Quito Tenis, Centro Norte;22/marzo/2020;;;
Vendo Departamento En Conjunto Privado Solanda;Departamentos; 43000;Calderón, Norte De Quito;22/marzo/2020;;;
Lindo Proyecto De Casas La Morita Timbaco Vip;Casa; 89900;Tumbaco, Valle Tumbaco;21/marzo/2020;;;
Suite Venta De Oportunidad O Para Inversión, Santa Lucía;Departamentos; 60000;Kennedy, Centro Norte;21/marzo/2020;;;
Venta Casa En Conjunto San Juan - Cumbaya;Casa; 260000;Cumbaya, Valle Tumbaco;21/marzo/2020;;;
Casa De Venta Sur De Quito Ciudadela Del Ejército.;Casa; 99000;Quitumbe, Sur De Quito;21/marzo/2020;;;
Venta Departamento En El Conjunto Buenaventura, Sector Marianitas, Calderon, Norte De Quito;Departamentos; 39850;Calderón, Norte De Quito;20/marzo/2020;;;
Vendo Casa No Adosada - Conjunto - Viña Alta - Jardines;Casa; 199000;Tumbaco, Valle Tumbaco;20/marzo/2020;;;
Lindas Casas En La Armenia;Casa; 119000;Conocoto, Valle Los Chillos;20/marzo/2020;;;
Vendo Departamento 3 Dormitorios - Ponceano;Departamentos; 105000;Ponceano, Norte De Quito;20/marzo/2020;;;
Departamento Venta 3 Dormitorios Monteserrin.;Departamentos; 280000;Monteserrin, Jipijapa, Centro Norte;20/marzo/2020;;;
Apartamento De Tres Dormitorios;Departamentos; 60000;El Condado, Norte De Quito;20/marzo/2020;;;
Se Vende Casa En Conjunto Bosques De Inchalillo, Sangolqui;Casa; 138000;Mariscal Sucre, Centro Norte;20/marzo/2020;;;
Vendo Amplio Departamento - 3 Habitaciones - Cotocollao;Departamentos; 110000;Cochapamba, Centro Norte;19/marzo/2020;;;
Suite De Venta, Quito Tenis, Edificio Moen;Departamentos; 110000;Rumipamba, Centro Norte;19/marzo/2020;;;
Casa Terreno De Venta Sector Conocoto Ontaneda;Casa; 249990;Conocoto, Valle Los Chillos;19/marzo/2020;;;
Departamento Nuevo En Venta, Sector De El Condado 149 M2, 3 Habitaciones, Cuarto De Huéspedes, 3 Gar;Departamentos; 147000;El Condado, Norte De Quito;19/marzo/2020;;;
Vendo Linda Casa Esquinera Sector Pomasqui, Mitad Del Mundo;Casa; 75000;Pomasqui, Norte De Quito;18/marzo/2020;;;
Venta Hermosa Casa Urbanización El Condado 314m2;Casa; 179000;Cotocollao, Norte De Quito;18/marzo/2020;;;
Vendo Departamento Con Amplio Jardín Privado, Sector Central;Departamentos; 165000;Rumipamba, Centro Norte;17/marzo/2020;;;
Vendo Casa En Capelo 170m2 En 2 Plantas Por Estrenar;Casa; 155000;Quito;17/marzo/2020;;;
Vendo, Venta De Casa Sector San Isidro Del Inca.;Casa; 99000;Kennedy, Centro Norte;17/marzo/2020;;;
Vendo Departamento 2 Habitaciones, Eloy Alfaro, Av. Portugal, 6 De Diciembre, La Carolina;Departamentos; 110000;Iñaquito, Centro Norte;16/marzo/2020;;;
Vendo O Cambio Precioso Departamento Quito Tenis;Departamentos; 350000;Rumipamba, Centro Norte;16/marzo/2020;;;
Casa En Venta En Conjunto Sector Ponceano Alto;Casa; 124000;Ponceano, Norte De Quito;16/marzo/2020;;;
Departamento De Venta En Cumbaya, Urb. Jardines Del Este;Departamentos; 200000;Cumbaya, Valle Tumbaco;16/marzo/2020;;;
Departamento En Venta Portugal Cerca A Eloy Alfaro 4 Habitaciones, 2 Parqueaderos;Departamentos; 175000;Iñaquito, Centro Norte;16/marzo/2020;;;
Casa De Venta En Fajardo;Casa; 119000;Quito;16/marzo/2020;;;
Oportunidad De Venta Hermosa Casa Dentro De Excelente Zona Residencial De Miravalle;Casa; 489000;Miravalle, Nayon - Tanda, Valle Tumbaco;15/marzo/2020;;;
Oportunidad Departamento De Venta,Solo $31.000;Departamentos; 31000;Solanda, Sur De Quito;15/marzo/2020;;;
Venta Departamento Amagasi Del Inca (Conjunto Privado) Embajada Americana;Departamentos; 118000;San Isidro Del Inca, Centro Norte;15/marzo/2020;;;
Hermoso Departamento Amoblado De Venta - Sector Norte De Quito - Granados Y 6 De Diciembre;Departamentos; 88000;Jipijapa, Centro Norte;14/marzo/2020;;;
Vendo Departamento Tres Dormitorios Sector Batan Bajo;Departamentos; 140000;El Batan, Iñaquito, Centro Norte;14/marzo/2020;;;
Vendo Linda Casa Urb Los Cedros Carcelen;Casa; 410000;Carcelen, Norte De Quito;14/marzo/2020;;;
Venta Quinta El Quinche Terreno 7.500m2;Casa; 270000;El Quinche, Valle Tumbaco;13/marzo/2020;;;
Suite Venta República De El Salvador;Departamentos; 93000;Iñaquito, Centro Norte;13/marzo/2020;;;
Vendo Casa Independiente De Un Solo Piso - 113 M2 - 3 Habitaciones - Norte De Quito;Casa; 115000;Kennedy, Centro Norte;13/marzo/2020;;;
Casa Rentera Con Local Comercial Sector Mercado Mayorista Sur De Quito;Casa; 150000;Solanda, Sur De Quito;13/marzo/2020;;;
Departamento De Venta En Quito Tenis Norte De Quito, El Bosque;Departamentos; 275000;Rumipamba, Centro Norte;13/marzo/2020;;;
Bellavista, Vendo Departamento 84 M², 2 Dorm.;Departamentos; 120000;Bellavista, Iñaquito, Centro Norte;13/marzo/2020;;;
Quito Tenis / El Bosque / Buenavista Departamento Venta, 176 M2, 3 Dormitorios, Balcón, Ascensor, Vista,Quito Norte;Departamentos; 240000;Rumipamba, Centro Norte;13/marzo/2020;;;
Campo Alegre 2;Casa; 650000;Monteserrin, Jipijapa, Centro Norte;31/marzo/2020;;;
Casa, Urbanización Privada En Venta O Alquiler, Zona Rancho San Francisco, Tanda;Casa; 595000;Nayon - Tanda, Valle Tumbaco;20/marzo/2020;;;
Casa Venta;Casa; 292000;Cumbaya, Valle Tumbaco;16/marzo/2020;;;
Casa Venta;Casa; 540000
            $100 alicuota;Cumbaya, Valle Tumbaco;19/febrero/2020;;;
Casa Venta;Casa; 230000;Norte De Quito;25/marzo/2020;;;
Venata, Casa, El Condado, Oportunidad, 460 M;Penthouse; 250000;El Condado, Norte De Quito;07/abril/2020;460;4;
Departamento Venta Bien Distribuido – Sector Embajada Americana;Departamentos; 145000;San Isidro Del Inca, Centro Norte;27/marzo/2020;;;
Venta De Departamento 3 Dormitorios, 110m2 Carcelén;Departamentos; 83500;Carcelen, Norte De Quito;11/abril/2020;;;
Venta Casa De Lujo 4 Dormitorios Excelente Vista Sector Quito Tenis;Casa; 1000000;Rumipamba, Centro Norte;07/abril/2020;;;
Venta Departamento El Batán,2 Dormitorios 2 Estacionamientos;Departamentos; 114900;Iñaquito, Centro Norte;10/abril/2020;;;
Departamento En Venta Sector La Shyris;Departamentos; 169900;Iñaquito, Centro Norte;09/abril/2020;;;
Venta Vendo Casas Sector Armenia 2, Valle De Los Chillos;Casa; 133000;Conocoto, Valle Los Chillos;08/abril/2020;;;
C/ González Suárez, Departamento De 210m2 En Venta, 3 Habitaciones;Departamentos; 238000;Gonzalez Suarez, Iñaquito, Centro Norte;07/abril/2020;;;
Casa En La Armenia Conjunto Prados De La Armenia;Casa; 118990;Conocoto, Valle Los Chillos;07/abril/2020;;;
Espectacular Penthouse Duplex En Venta Sector Gonzalez Suarez Centro Norte De Quito Isabel La Catolica Y Zaldumbide;Departamentos; 750000;Mariscal Sucre, Centro Norte;07/abril/2020;;;
Vendo Suite De Oportunidad Sector Jipijapa;Departamentos; 68000;Jipijapa, Centro Norte;06/abril/2020;;;
Venta Departamento Orellana Y 12 De Octubre Edificio Jericó;Departamentos; 261000;Iñaquito, Centro Norte;14/marzo/2020;;;
Cumbaya Departamento En Venta Por Estrenar En Urb. Privada;Departamentos; 730000;Cumbaya, Valle Tumbaco;05/abril/2020;;;
Vendo Casa Jardín, Nayón, Precio Especial Feria - Wasi;Casa; 169000;Nayon - Tanda, Valle Tumbaco;31/marzo/2020;;;
1pbcumbayá. La Primavera. Venta. Depart 108m 3dormitorios+Patio 74,33m;Departamentos; 183949;Cumbaya, Valle Tumbaco;04/abril/2020;;;
Departamento De Lujo Por Estrenar En La Av Coruña;Departamentos; 230238;Iñaquito, Centro Norte;03/abril/2020;;;
Casa De Venta En La Armenia, Cerca Al Parque Metropolitano;Casa; 160000;Conocoto, Valle Los Chillos;03/abril/2020;;;
Vendo Departamento Sector El Bosque;Departamentos; 138000;Cochapamba, Centro Norte;02/abril/2020;;;
Amplia Casa En Venta,Tres Habitaciones Con Baño Privado,Autopista General Rumiñahui;Casa; 135000;Conocoto, Valle Los Chillos;02/abril/2020;;;
Hermosa Casa De Venta Cumbaya, Jacuzzi Exterior, Amplio Jardín, Esquinera. La Viña, Conjunto Privado;Casa; 415000;Tumbaco, Valle Tumbaco;01/abril/2020;;;
Batan Ana Luisa Vendo Oportunidad Departamento;Departamentos; 128000;El Batan, Iñaquito, Centro Norte;27/marzo/2020;;;
Vendo Departamentos En Calderón;Departamentos; 43990;Calderón, Norte De Quito;31/marzo/2020;;;
Venta De Casa Vip En Sangolqui;Casa; 69900;Quito;31/marzo/2020;;;
Vendo Departamento 3 Dormitorios Edificio De Lujo. Av. Orellana / Cerca Coruña / Norte De Quito;Departamentos; 130000;Mariscal Sucre, Centro Norte;22/marzo/2020;;;
En Venta Casas En Calderon Por Estrenar, 3 Dormitorios;Casa; 78500;Calderón, Norte De Quito;30/marzo/2020;;;
Acogedora Y Luminosa Suite - Centro Norte De Quito;Departamentos; 75000;Bellavista, Iñaquito, Centro Norte;30/marzo/2020;;;
Venta Suit Muy Iluminada 56m2 - Rep Salvador;Departamentos; 100000;Iñaquito, Centro Norte;30/marzo/2020;;;
Casa Rentera Centro Histórico, Usd150.000;Casa; 150000;San Juan, Centro Colonial;30/marzo/2020;;;
Venta De Casa En La Armenia, Valle De Los Chillos;Casa; 155000;Conocoto, Valle Los Chillos;08/abril/2020;;;
Venta Departamento Sector El Batán - 180 M2;Departamentos; 160000;Jipijapa, Centro Norte;29/marzo/2020;;;
Venta De Departamento, Sin Amoblar, Dos Habitaciones. Sector El Batán;Departamentos; 120000;El Batan, Iñaquito, Centro Norte;29/marzo/2020;;;
Venta Suit Inca;Departamentos; 70000;Iñaquito, Centro Norte;28/marzo/2020;;;
Oportunidad Casa De Venta La Armenia 3 Dormitorios;Casa; 112000;Conocoto, Valle Los Chillos;02/abril/2020;;;
Casa En Venta En La Armenia, Valle De Los Chillos;Casa; 94000;Conocoto, Valle Los Chillos;19/marzo/2020;;;
Hermosa Quinta Sector Mirasierra;Casa; 2785000;Alangasí, Valle Los Chillos;27/marzo/2020;;;
Venta De Departamento En San Fernando;Departamentos; 75000;Quito Tenis, Centro Norte;21/marzo/2020;;;
Departamento De Venta En Quito Centro Norte Batan Alto Portugal Cod: V025;Departamentos; 149000;Iñaquito, Centro Norte;25/marzo/2020;;;
Venta De Casa (140m2). Valle De Los Chillos/San Pedro De Taboada;Casa; 130000;Conocoto, Valle Los Chillos;24/marzo/2020;;;
Vendo Casa En Tanda;Casa; 379000;San Isidro Del Inca, Centro Norte;23/marzo/2020;;;
Venta De Departamento, Diamond Miravalle, Cumbaya;Departamentos; 220000;Itchimbía, Centro Colonial;23/marzo/2020;;;
Venta Casa Norte De Quito Carcelén Conjunto Privado El Olivar 2;Casa; 85000;Carcelen, Norte De Quito;23/marzo/2020;;;
Casa En Venta Quito/ Mitad Del Mundo/ Norte De Quito;Casa; 149990;San Antonio De Pichincha, Norte De Quito;22/marzo/2020;;;
Departamento En Venta En Cumbaya Sector Site Center;Departamentos; 514000;Cumbaya, Valle Tumbaco;09/abril/2020;;;
Hermosa Casa En Venta Sector Ponceano / Norte De Quito;Casa; 124900;Ponceano, Norte De Quito;22/marzo/2020;;;
Casa De Venta, Sector Sangolqui, Cerca Univ. Espe;Casa; 87000;Quito;21/marzo/2020;;;
Departamento En Venta Republica Del Salvador;Departamentos; 135000;Iñaquito, Centro Norte;04/abril/2020;;;
Vendo Suite En La Avenida República Del Salvador Y Naciones Unidas;Departamentos; 74000;Iñaquito, Centro Norte;21/marzo/2020;;;
Vendo Casa La Pampa;Casa; 230000;Pomasqui, Norte De Quito;20/marzo/2020;;;
Iñaquito Alto, Exclusivo Departmento Centro Norte De Quito;Departamentos; 125000;Rumipamba, Centro Norte;18/marzo/2020;;;
Luxemburgo Suite De Venta 77m2;Departamentos; 100000;Iñaquito, Centro Norte;07/abril/2020;;;
Oportunidad Inversión Suite República Del Salvador;Departamentos; 93900;Iñaquito, Centro Norte;18/marzo/2020;;;
Venta Deparatamento Av.America Y Villalengua;Departamentos; 260000;Rumipamba, Centro Norte;18/marzo/2020;;;
Últimos Departamento De 3 Dorm. Con Acabados De Primera Sector Tumbaco - Las Acasias;Departamentos; 122000;Tumbaco, Valle Tumbaco;17/marzo/2020;;;
Venta Departamento Planta Baja En Cumbaya Con Acceso Al Chaquiñan Cerca Del Cc: Scala Con Gimnasio/ Piscina/Cine;Departamentos; 159000;Cumbaya, Valle Tumbaco;16/marzo/2020;;;
Casa De Venta En La Mitad Del Mundo, Norte De Quito, Cerca A La Nueva Av. Simón Bolívar;Casa; 54000;San Antonio De Pichincha, Norte De Quito;13/marzo/2020;;;
Venta Departamento Centro Norte-Las Casas;Departamentos; 65000;Belisario Quevedo, Centro Norte;15/marzo/2020;;;
Cxc Venta Casa, Guamani Alto, Sur De Quito, Exp. 3495;Casa; 76900;Belisario Quevedo, Centro Norte;14/marzo/2020;;;
De Oportunidad Departamento De 3 Habitaciones Sector Unión Nacional - El Bosque;Departamentos; 115000;Rumipamba, Centro Norte;10/abril/2020;;;
Venta Casa La Granja America-El Bosque;Otro; 200000;Iñaquito, Centro Norte;11/abril/2020;;;
Vendo Lindo Departamento Con Balcon / Colegio Sek;Departamentos; 129000;San Isidro Del Inca, Centro Norte;09/abril/2020;;;
Venta Casa Sector La Armenia Valle De Los Chillos, San Rafael, Conocoto Quito;Casa; 129000;La Armenia I, Conocoto, Valle Los Chillos;11/abril/2020;;;
Casa Con Terreno De Lujo Sector Tumbaco;Casa; 630000;Tumbaco, Valle Tumbaco;10/abril/2020;;;
Venta Casa, 222,39m², 3 Dormitorios, Cumbayá;Casa; 299000;Cumbaya, Valle Tumbaco;10/abril/2020;;;
Venta De Suite De 65 M² Sector El Bosque;Departamentos; 89000;Cochapamba, Centro Norte;18/marzo/2020;;;
Quito Tennis, Duplex 4 Dormitorios.;Departamentos; 320000;Rumipamba, Centro Norte;24/marzo/2020;;;
Norte, Bosque. Cerca Al Parque Pinar Alto- Bosque.;Casa; 165000;El Pinar, Concepción, Centro Norte;09/abril/2020;;;
Venta De Casas, Sector La Armenia, Cerca Del Parque La Armenia;Casa; 75000;Conocoto, Valle Los Chillos;08/abril/2020;;;
En Venta Hermoso Departamento 90m2 - Carcelén;Departamentos; 65000;Carcelen, Norte De Quito;09/abril/2020;;;
Casa De Venta, 4 Dormitorios, Sector Puembo, Conjunto Cerrado;Casa; 900000;Puembo, Valle Tumbaco;13/marzo/2020;;;
Dos Hemisferios, Vendo Departamento 70m2, 3 Dormitorios, Primer Piso, Remodelado, Con Mejoras $59.000;Departamentos; 59000;Pomasqui, Norte De Quito;08/abril/2020;;;
Me/Sector Quito Tenis Lindo Penthouse De Venta!!;Departamentos; 380000;Rumipamba, Centro Norte;07/abril/2020;;;
Venta Departamento Localizado En Eloy Cerca A Solca;Departamentos; 71500;El Batan, Iñaquito, Centro Norte;08/abril/2020;;;
En Venta, Casa, Quito Tenis;Casa; 300000;Rumipamba, Centro Norte;08/abril/2020;;;
Venta De Casa Grande Naciones Unidas En Conjunto Estilo Mediterraneo;Casa; 280000;Granda Centeno, Rumipamba, Centro Norte;07/abril/2020;;;
Departamento De 326 Me De Venta, Quito Tenis, Centro Norte De Quito;Departamentos; 265000;Quito Tenis, Centro Norte;07/abril/2020;;;
Casa En Venta 164m2 Por Estrenar En Santa Lucía;Casa; 208398;Kennedy, Centro Norte;07/abril/2020;;;
Departamento 3 Dormitorios Cerca La Carolina De Venta;Departamentos; 126000;Iñaquito, Centro Norte;07/abril/2020;;;
Departamento De Venta Por Estrenar Urbanizacion El Condadocondado;Departamentos; 183085;El Condado, Norte De Quito;07/abril/2020;;;
Venta Departamento Mitad Del Mundo;Departamentos; 50000;San Antonio De Pichincha, Norte De Quito;07/abril/2020;;;
Casa De Venta A Estrenar En Calderón Cerca Al Hospital;Casa; 85000;Calderón, Norte De Quito;07/abril/2020;;;
Departamento De 2 Dormitorios En Sector La Coruña Por Estraner;Departamentos; 169065;Iñaquito, Centro Norte;07/abril/2020;;;
Calderón Casa De Venta , Carapungo, Vía Marianitas, Llano Grande, Chico;Casa; 70000;Calderón, Norte De Quito;06/abril/2020;;;
Pusuqui Vendo Amplia Casa Independiente 3 Dorm 3 Baños + Local Comercial;Casa; 115000;Pomasqui, Norte De Quito;06/abril/2020;;;
Departamento 2 Dormitorios, 76m2, Sector La Carolina;Departamentos; 115000;Iñaquito, Centro Norte;25/marzo/2020;;;
Venta Departamentos En Tumbaco, Sector Tola Chica Cerca De Av. Interoceánica Y Ruta Viva;Departamentos; 135000;Tumbaco, Valle Tumbaco;06/abril/2020;;;
Departamento En Venta Sector Monteserrin Bromelias;Departamentos; 230000;Jipijapa, Centro Norte;04/abril/2020;;;
Vendo Departamento Por Estrenar U. Católica;Departamentos; 205000;Mariscal Sucre, Centro Norte;04/abril/2020;;;
Vendo Departamento De 2 Dormitorios Sector 6 De Diciembre Y El Inca;Departamentos; 80000;Jipijapa, Centro Norte;04/abril/2020;;;
Venta O Renta Departamento, 3d, Con Balcones 130m2, En La Bossano Tras El Cne;Departamentos; 171000;Bellavista, Iñaquito, Centro Norte;03/abril/2020;;;
Casa Rentera De Venta , La Recoleta Excelente Inversión - Centro De Quito;Casa; 250000;Centro De Quito, Centro Colonial;27/marzo/2020;;;
Suite De Venta Sector El Bosque - Union Nacional. Centro Norte De Quito;Departamentos; 72480;Rumipamba, Centro Norte;02/abril/2020;;;
Vendo Hermosa Casa, Sector Ponceano;Casa; 170000;Ponceano, Norte De Quito;01/abril/2020;;;
Departamento A Estrenar 3 Dormitorios En Venta - Av. Orellana - Centro Norte Quito;Departamentos; 164927;Mariscal Sucre, Centro Norte;27/marzo/2020;;;
Departamento Como Casa Urb. Las Bromelias/ 4 Dorm.;Casa; 595000;Jipijapa, Centro Norte;26/marzo/2020;;;
De Oportunidad Venta Casa Rentera Con 5 Departamento En Solanda, Sur De Quito;Casa; 158000;Solanda, Sur De Quito;29/marzo/2020;;;
Venta Casa Terminal Quitumbe;Casa; 60000;Quitumbe, Sur De Quito;19/marzo/2020;;;
Venta O Arriendo Dpto La Brasil;Departamentos; 230000;Rumipamba, Centro Norte;24/marzo/2020;;;
Amplio Departamento En Venta, Espectacular Vista, 4 Dormitorios, Quito Tenis;Departamentos; 295000;Cochapamba, Centro Norte;01/abril/2020;;;
Vendo Casa 4d En Los Laureles;Casa; 223500;Jipijapa, Centro Norte;29/marzo/2020;;;
Vendo Linda Casa, Miravalle 1. 4 Dormitorios.;Casa; 380000;Miravalle, Nayon - Tanda, Valle Tumbaco;17/marzo/2020;;;
Vendo Departamento 3 Dorm. Norte De Quito Galo Plaza;Departamentos; 57000;Kennedy, Centro Norte;30/marzo/2020;;;
Volv006 En Venta Hermosa Y Moderna Suite, Excelente Sector Av. Cristóbal Colón.;Departamentos; 82000;Mariscal Sucre, Centro Norte;31/marzo/2020;;;
Departamento En Venta, Sector Collaloma, Comité Del Pueblo, Por La Av Eloy Alfaro, Junto A Dhl;Departamentos; 68000;Comité Del Pueblo, Centro Norte;31/marzo/2020;;;
Vendo Suite Completamente Amoblada A Excelente Precio En El Sector Del Bosque (Edf. Tenis Boulevard) Para Habitarla O;Departamentos; 119000;Quito Tenis, Centro Norte;27/marzo/2020;;;
Venta Departamento Pomasqui;Departamentos; 69000;Pomasqui, Norte De Quito;30/marzo/2020;;;
Se Vende Casa Valle Los Chillos Puente 9 Armenia;Casa; 179000;Conocoto, Valle Los Chillos;29/marzo/2020;;;
Venta De Casa Con 1.102.61 De Construcción En Nayon.;Casa; 550000;Nayon - Tanda, Valle Tumbaco;29/marzo/2020;;;
Venta De Propiedad/Local/Departamentos Vía Principal Av. 6 De Diciembre;Casa; 287000;Kennedy, Centro Norte;28/marzo/2020;;;
Departamento En La Eloy Alfaro Y Portugal, Sector El Batán, Vendo Por Viaje.;Departamentos; 235000;Bellavista, Iñaquito, Centro Norte;16/marzo/2020;;;
Sector Carcelen Comodo Departamento Tres Dormitorios, 82 Mts., Conjunto Cerrado, Areas Verdes;Departamentos; 78000;Carcelen, Norte De Quito;19/marzo/2020;;;
Espectacular Departamento De Lujo Unión Nacional 205 Mtrs;Departamentos; 209000;La Concepcion, Concepción, Centro Norte;23/marzo/2020;;;
Venta Casa Independiente Tres Habitaciones Nueva A Estrenar Dos Plantas "Complejo Turístico Mitad Del Mundo" $75.000;Casa; 75000;San Antonio De Pichincha, Norte De Quito;27/marzo/2020;;;
Vendo Departamento Nuevo En Nayon En Pb Cod 107-18;Departamentos; 115000;Nayon - Tanda, Valle Tumbaco;27/marzo/2020;;;
Casa Nueva En Conjunto Cerrado Con Piscina - Calderón - Si Aplica Crédito Vip - Si Venezolano, Extranjero Y Nacional;Casa; 68990;Calderón, Norte De Quito;26/marzo/2020;;;
Casa Independiente De Venta Al Sur De Quito Sector Turubamba De Monjas;Casa; 83000;La Ecuatoriana, Sur De Quito;26/marzo/2020;;;
Suite En Venta 55 M2. Sector La Carolina.;Departamentos; 70000;Iñaquito, Centro Norte;25/marzo/2020;;;
Casa De Venta Con Jardín Y Terraza, Norte De Quito, Sector Colegios Martim Cereré, Sek, Lethort, Tomás Moro;Casa; 137000;San Isidro Del Inca, Centro Norte;23/marzo/2020;;;
Departamento En La Carolina;Departamentos; 162500;Iñaquito, Centro Norte;13/marzo/2020;;;
Be/ Parque Inglés - De Venta Estupendo Departamento 3 Dormitorios Cod. De - 001113;Departamentos; 118000;San Carlos, Concepción, Centro Norte;23/marzo/2020;;;
Venta Duplex Sector Rancho San Francisco;Departamentos; 340000;Nayon - Tanda, Valle Tumbaco;21/marzo/2020;;;
Casa De Venta Colinas Del Pichincha;Casa; 270000;Quito Tenis, Centro Norte;22/marzo/2020;;;
Vendo Casa En Conjunto Privado Sector Marianitas-Buenaventura;Casa; 55000;Calderón, Norte De Quito;21/marzo/2020;;;
Venta Casa Dentro De Conjunto, Sector Rancho San Francisco;Casa; 355000;Nayon - Tanda, Valle Tumbaco;16/marzo/2020;;;
Casa De Venta Sur De Quito, Terminal Terrestre De Guamaní;Casa; 83000;Turubamba, Sur De Quito;21/marzo/2020;;;
Lindos Departamentos En El Pinar;Departamentos; 122000;Concepción, Centro Norte;20/marzo/2020;;;
Vendo Departamento 3 Dormitorios - El Bosque;Departamentos; 130000;Quito Tenis, Centro Norte;20/marzo/2020;;;
Vendo Hermosa Casa Con Terreno - La Morita - Tumbaco;Casa; 690000;Tumbaco, Valle Tumbaco;19/marzo/2020;;;
Casa De Venta En Carapungo;Casa; 80000;Carapungo, Calderón, Norte De Quito;19/marzo/2020;;;
Casa En Venta Sector Tumbaco;Casa; 119990;Tumbaco, Valle Tumbaco;19/marzo/2020;;;
Casa De Venta, Armenia, 183 M2, Urbanización Cerrada $156000;Casa; 139500;Conocoto, Valle Los Chillos;14/marzo/2020;;;
Casas De Venta En Llano Chico;Casa; 69990;Llano Chico, Norte De Quito;18/marzo/2020;;;
Amplia Casa, Sector Colegio Einstein 229m;Casa; 129000;Carcelen, Norte De Quito;18/marzo/2020;;;
Venta Casa, Sector Amagasi Del Inca, Embajada Americana, Colegio Sek;Casa; 150000;Kennedy, Centro Norte;16/marzo/2020;;;
Venta Departamento Sector Kennedy;Departamentos; 125000;Kennedy, Centro Norte;16/marzo/2020;;;
Departamento De Venta En Conocoto;Departamentos; 57500;Conocoto, Valle Los Chillos;16/marzo/2020;;;
Amplia Casa De 4 Dormitorios Y Gran Jardin, Cerca Del Rancho San Francisco. Por Viaje Se Bajan Precio , Gran Oportunidad;Casa; 420000;Puengasí, Centro Colonial;15/marzo/2020;;;
Vendo Departamento Tres Dormitorios En Carolina;Departamentos; 290000;Iñaquito, Centro Norte;14/marzo/2020;;;
Venta Dpto Duplex Gonzalez Suarez;Departamentos; 183000;Gonzalez Suarez, Iñaquito, Centro Norte;13/marzo/2020;;;
Hermosas Casas A Estrenar Conjunto Bricanto Tumbaco;Casa; 145000;Tumbaco, Valle Tumbaco;13/marzo/2020;;;
Casa De Venta Oportunidad Al Norte De Quito - Calderon;Casa; 198000;Calderón, Norte De Quito;13/marzo/2020;;;
Puembo, Hermosa Casa En Conjunto Privado. Por Estrenar;Casa; 140000;Puembo, Valle Tumbaco;13/marzo/2020;;;
Mariano Pozo 56;Departamentos; 130000
            $80 alicuota;Ponceano, Norte De Quito;31/marzo/2020;;;
Casa En Venta, Cumbayá;Casa; 1650000;Cumbaya, Valle Tumbaco;16/marzo/2020;;;
Departamentos Venta;Departamentos; 49900;Calderón, Norte De Quito;16/marzo/2020;;;
República De El Salvador 222;Departamentos; 118000
            $80 alicuota;La Carolina, Iñaquito, Centro Norte;10/diciembre/2019;;;
Casa Venta;Casa; 115000
            $60 alicuota;El Condado, Norte De Quito;22/febrero/2020;;;
Departamento En Venta, Sector Monteserrín, 184 Mts 2;Departamentos; 205000;Monteserrin, Jipijapa, Centro Norte;03/abril/2020;;;
Departamento De 3 Dormitorios En Colinas Del Pichincha;Departamentos; 260000;Rumipamba, Centro Norte;06/abril/2020;436;3;
Venta Departamento, Centro Norte, Sector Udla Granados;Departamentos; 75000;La Argelia, Sur De Quito;27/marzo/2020;;;
Amplia Suite De Venta En Bosmediano;Departamentos; 88000;Bellavista, Iñaquito, Centro Norte;13/marzo/2020;;;
Vendo Exclusivo Penthouse En Suiza Y Eloy Alfaro;Departamentos; 330000;Iñaquito, Centro Norte;05/abril/2020;;;
Departamento De Venta, Sector Monteserrín, Norte De Quito, La Udla, Barato, Vendo;Departamentos; 149000;Jipijapa, Centro Norte;08/abril/2020;;;
C/ Carcelén Bajo! Hermoso Departamento De 92m2 En Venta!! A Estrenar!!;Departamentos; 90000;Carcelen, Norte De Quito;07/abril/2020;;;
Casa Cerca De La Embajada Americana Urb. Orquideas Del Norte;Casa; 330000;San Isidro Del Inca, Centro Norte;07/abril/2020;;;
Excelente Casa En Venta Sector Ponceano Norte De Quito En La Mercedes Gonzalez Y Alberto Einstein;Casa; 240000;Ponceano, Norte De Quito;27/marzo/2020;;;
Vendo Departamento. Vista Hermosa. Cotocollao;Departamentos; 120000;Cotocollao, Norte De Quito;06/abril/2020;;;
Venta El Bosque Carvajal Y Brasil,Oportunidad Casa En Venta;Casa; 480000;Rumipamba, Centro Norte;14/marzo/2020;;;
Cumbaya Dos Departamentos A Estrenar - Sector Urbanización Auqui Chico;Departamentos; 588587;Cumbaya, Valle Tumbaco;04/abril/2020;;;
Departamento En Venta, Ponceano Precio Reducido! - Wasi;Departamentos; 95000;Ponceano, Norte De Quito;27/marzo/2020;;;
402 Quito Tenis. Vendo Departamento 75 Metros De 2 Dormitorios Con Balcón. A Estrenar;Departamentos; 140000;Rumipamba, Centro Norte;12/04/2020;;;
Departamento De Venta, Norte De Quito, Colegio Einstein,;Departamentos; 110000;La Concepcion, Concepción, Centro Norte;03/abril/2020;;;
Departamento De Venta En El Quito Tenis;Departamentos; 260000;Rumipamba, Centro Norte;03/abril/2020;;;
Vendo Casa 175 M² Conjunto Privado Cerca Al Colegio Sek;Casa; 160000;San Isidro Del Inca, Centro Norte;01/abril/2020;;;
Oportunidad!!! Hermosa Quinta Con Casa Y Construcción Adicional, A 2 Min Del Parque Metropolitano De La Armenia;Casa; 480000;Conocoto, Valle Los Chillos;02/abril/2020;;;
