NOMBRE_CONJUNTO;TIPO_BIEN;PRECIO;LOCALIZACIÓN;FECHA_PUBLICACIÓN;ÁREA m²;NUM_HABITACIONES;NOMBRE_PROYECTO
Lindas Casas En La Armenia;Casa; 119000;Conocoto, Valle Los Chillos;20/marzo/2020;;;
Se Vende Casa De Lujo Nueva, En La Mitad Del Mundo, San Antonio De Pichincha;Casa; 155000;San Antonio De Pichincha, Norte De Quito;10/marzo/2020;;;
Vendo Casa En Conjunto Privado. Norte Quito - Carapungo;Casa; 64000;Carapungo, Calderón, Norte De Quito;10/marzo/2020;;;
Casa De Venta Norte, San José De Morán, Cerca A La Av Simón Bolívar.;Casa; 68000;Calderón, Norte De Quito;10/marzo/2020;;;
Casa En Venta 160m2 En Pusuqui Dentro De Conjunto San Gregorio II;Casa; 128000;Pomasqui, Norte De Quito;10/marzo/2020;;;
Casa Rentera En Carcelen;Casa; 130000;Carcelen, Norte De Quito;10/marzo/2020;;;
Casa De Venta En Cumbayá/ Tumbaco/ Ventura Mall/ Quito;Casa; 217000;Tumbaco, Valle Tumbaco;10/marzo/2020;;;
Venta Departamento Nuevo 3 Dormitorios Nayon / Tanda / Miravalle / Valle Quito;Departamentos; 198000;Nayon - Tanda, Valle Tumbaco;10/marzo/2020;;;
Venta Departamento Sector Ponciano Para Estrenar;Departamentos; 130000;Ponceano, Norte De Quito;10/marzo/2020;;;
Venta Casa Por Estrenar Sector La Morita, Valle De Tumbaco;Casa; 1100000;Tumbaco, Valle Tumbaco;10/marzo/2020;;;
Venta Casa Con Proyección, Esquinera. Norte De Quito. Sector Consejo Provincial;Casa; 123000;El Condado, Norte De Quito;10/marzo/2020;;;
Vendo Lindo Apartamento De 3 Dormitorios Por La Carolina;Departamentos; 129000;La Carolina, Iñaquito, Centro Norte;11/marzo/2020;;;
Amplia Casa De Venta Norte De Quito California Alta;Casa; 268000;Kennedy, Centro Norte;10/marzo/2020;;;
Venta Suite Nueva Ute Rumipamba Burgeois Parque Teresa Cepeda;Departamentos; 75000;Rumipamba, Centro Norte;10/marzo/2020;;;
En Venta Hermoso Departamento Quito Tenis Edificio Feijó 91;Departamentos; 320000;Rumipamba, Centro Norte;10/marzo/2020;;;
Departamento De Venta 3 Dormitorios , Con Ascensor - Sector El Edén;Departamentos; 90000;San Isidro Del Inca, Centro Norte;10/marzo/2020;;;
Pomasqui , Casa 120 Mts.2 Plantas Sin Acabados , Lindo Conjunto Privado, Piscina;Casa; 95000;Pomasqui, Norte De Quito;28/marzo/2020;;;
Vendo, Venta De Casa Sector San Isidro Del Inca.;Casa; 99000;Kennedy, Centro Norte;17/marzo/2020;;;
Vendo Casas En La Mitad Del Mundo, Cerca Unasur;Casa; 76300;San Antonio De Pichincha, Norte De Quito;10/marzo/2020;;;
Vendo Suite Gaspar De Villarroel;Departamentos; 73000;Jipijapa, Centro Norte;10/marzo/2020;;;
Vendo Casa 200mts2, 3 Dormitorios,Sector Colegio Einstein;Casa; 220000;Tumbaco, Valle Tumbaco;10/marzo/2020;;;
Venta Casa Valle De Los Chillos Buen Precio;Casa; 75000;Quito;01/abril/2020;;;
•Vendo Hermosa Casa En Cumbaya Lugar Exclusivo;Casa; 685000;Cumbaya, Valle Tumbaco;10/marzo/2020;;;
Ojo!! Bajo Precio! Amplio Apartamento 4 Dormitorios Terraza Privada Patio 2 Garages Bodega - El Condado;Departamentos; 119500;Cotocollao, Norte De Quito;10/marzo/2020;;;
Se Vende Hermoso Departamento Por Estrenar Sector Granda Centeno;Departamentos; 143000;Granda Centeno, Rumipamba, Centro Norte;10/marzo/2020;;;
Venta Departamento El Batán,2 Dormitorios 2 Estacionamientos;Departamentos; 114900;Iñaquito, Centro Norte;10/marzo/2020;;;
Departamento En Venta A Estrenar 3 Dormitorios - Centro Norte - El Batán - Quito;Departamentos; 219239;Iñaquito, Centro Norte;01/abril/2020;;;
Departamento De 3 Dormitorios En Llano Grande;Departamentos; 50000;Calderón, Norte De Quito;10/marzo/2020;;;
En Venta Hermoso Departamento Con Jardín En Miravalle 1;Departamentos; 200000;Miravalle, Nayon - Tanda, Valle Tumbaco;10/marzo/2020;;;
Venta De Casa Terreno Los Chillos, Sector Los Cuarteles;Casa; 208000;Conocoto, Valle Los Chillos;10/marzo/2020;;;
Venta Vendo Casas Sector Armenia 2, Valle De Los Chillos;Casa; 133000;Conocoto, Valle Los Chillos;10/marzo/2020;;;
Casa De Venta Independiente, Los Chillos, 4 Dormitorios;Casa; 145000;Quito;11/marzo/2020;;;
Me/Sector Quito Tenis Lindo Departamento De 02 Dormitorios En Venta!!;Departamentos; 130000;Rumipamba, Centro Norte;03/abril/2020;;;
Bonita Casa Rentera De Venta Al Sur De Quito Sector Turubamba;Casa; 105000;Solanda, Sur De Quito;12/marzo/2020;;;
Calderón Casa De Venta , Carapungo, Vía Marianitas, Llano Grande, Chico;Casa; 70000;Calderón, Norte De Quito;06/abril/2020;;;
Venta De Suite De 65 M² Sector El Bosque;Departamentos; 89000;Cochapamba, Centro Norte;18/marzo/2020;;;
Pusuqui Vendo Amplia Casa Independiente 3 Dorm 3 Baños + Local Comercial;Casa; 115000;Pomasqui, Norte De Quito;06/abril/2020;;;
Casa En Venta 164m2 Por Estrenar En Santa Lucía;Casa; 208398;Kennedy, Centro Norte;07/04/2020;;;
Departamento 2 Dormitorios, 76m2, Sector La Carolina;Departamentos; 115000;Iñaquito, Centro Norte;25/marzo/2020;;;
Venta Casa Sector La Armenia Valle De Los Chillos, San Rafael, Conocoto Quito;Casa; 129000;La Armenia I, Conocoto, Valle Los Chillos;28/marzo/2020;;;
Vendo Casa Armenia Por Estrenar;Casa; 110000;Conocoto, Valle Los Chillos;07/04/2020;;;
Se Vende, Departamento, El Bosque;Departamentos; 150000;Quito Tenis, Centro Norte;06/abril/2020;;;
Venta Departamentos En Tumbaco, Sector Tola Chica Cerca De Av. Interoceánica Y Ruta Viva;Departamentos; 135000;Tumbaco, Valle Tumbaco;06/abril/2020;;;
Venta De Casas A Estrenar Mitad Del Mundo Dentro De Urbanización Muy Segura Y Cerca De Todo Lo Comercial;Casa; 103990;San Antonio De Pichincha, Norte De Quito;27/marzo/2020;;;
Vendo Departamento Por Estrenar U. Católica;Departamentos; 205000;Mariscal Sucre, Centro Norte;04/abril/2020;;;
Vendo Departamento De 2 Dormitorios Sector 6 De Diciembre Y El Inca;Departamentos; 80000;Jipijapa, Centro Norte;04/abril/2020;;;
Suite De Venta Sector El Bosque - Union Nacional. Centro Norte De Quito;Departamentos; 72480;Rumipamba, Centro Norte;02/abril/2020;;;
Vendo Casa 340 M Sector El Bosque;Casa; 270000;Quito Tenis, Centro Norte;22/marzo/2020;;;
Vendo Hermosa Casa, Sector Ponceano;Casa; 170000;Ponceano, Norte De Quito;01/abril/2020;;;
Departamento Como Casa Urb. Las Bromelias/ 4 Dorm.;Casa; 595000;Jipijapa, Centro Norte;26/marzo/2020;;;
De Oportunidad Venta Casa Rentera Con 5 Departamento En Solanda, Sur De Quito;Casa; 158000;Solanda, Sur De Quito;29/marzo/2020;;;
Hermoso Departamento De Venta En San Isidro Del Inca;Departamentos; 105000;San Isidro Del Inca, Centro Norte;10/marzo/2020;;;
Venta Casa Terminal Quitumbe;Casa; 60000;Quitumbe, Sur De Quito;19/marzo/2020;;;
Venta Casa Tumbaco, Las Peñas;Casa; 235000;Tumbaco, Valle Tumbaco;30/marzo/2020;;;
Departamento En Venta, Espectacular Vista, Piscina, El Bosque;Departamentos; 295000;Cochapamba, Centro Norte;01/abril/2020;;;
Vendo Casa 4d En Los Laureles;Casa; 223500;Jipijapa, Centro Norte;29/marzo/2020;;;
Casa De 117 En Llano Grande;Casa; 74000;Calderón, Norte De Quito;24/marzo/2020;;;
Suite En Urbanizacion El Condado De Venta;Departamentos; 80000;El Condado, Norte De Quito;31/marzo/2020;;;
Departamento En Venta, Sector Collaloma, Comité Del Pueblo, Por La Av Eloy Alfaro, Junto A Dhl;Departamentos; 68000;Comité Del Pueblo, Centro Norte;31/marzo/2020;;;
**Arrayanes Country Club ** Vendo Casa En El Green De Golf **Antisismica.Estructura De Acero**Elegancia Y Sobriedad**;Casa; 3000000;Puembo, Valle Tumbaco;10/marzo/2020;;;
Departamento De Venta Cerca A La Universidad Ute Y Universidad Central;Departamentos; 150000;Rumipamba, Centro Norte;10/marzo/2020;;;
Departamento En La Eloy Alfaro Y Portugal, Sector El Batán, Vendo Por Viaje.;Departamentos; 235000;Bellavista, Iñaquito, Centro Norte;16/marzo/2020;;;
Venta Casa Independiente Tres Habitaciones Nueva A Estrenar Dos Plantas "Complejo Turístico Mitad Del Mundo" $75.000;Casa; 75000;San Antonio De Pichincha, Norte De Quito;27/marzo/2020;;;
Guapulo Vendo Hermosa Vista 2 Dormitorios;Departamentos; 87000;Itchimbía, Centro Colonial;12/marzo/2020;;;
Vendo Centro Norte. Batan. Por Megamaxi;Departamentos; 160000;Iñaquito, Centro Norte;24/marzo/2020;;;
Casa Nueva En Conjunto Cerrado Con Piscina - Calderón - Si Aplica Crédito Vip - Si Venezolano, Extranjero Y Nacional;Casa; 68990;Calderón, Norte De Quito;26/marzo/2020;;;
Casa Independiente De Venta Al Sur De Quito Sector Turubamba De Monjas;Casa; 83000;La Ecuatoriana, Sur De Quito;26/marzo/2020;;;
Suite En Venta 55 M2. Sector La Carolina.;Departamentos; 70000;Iñaquito, Centro Norte;25/marzo/2020;;;
Granda Centeno, Casa De Venta, Centro Norte De Quito;Casa; 355000;Quito Tenis, Centro Norte;24/marzo/2020;;;
Casa De Venta Con Jardín Y Terraza, Norte De Quito, Sector Colegios Martim Cereré, Sek, Lethort, Tomás Moro;Casa; 137000;San Isidro Del Inca, Centro Norte;23/marzo/2020;;;
En Venta Casas Vip De 90m2 - Mitad Del Mundo;Casa; 70000;San Antonio De Pichincha, Norte De Quito;23/marzo/2020;;;
Venta De Espectacular Departamento En Un Edificio Inteligente De 24 Pisos, En La República Del Salvador;Departamentos; 181917;Iñaquito, Centro Norte;23/marzo/2020;;;
Departamentos Por Estrenar Rusia Y Shyris;Departamentos; 152622;Iñaquito, Centro Norte;10/marzo/2020;;;
Vendo Casa En Conjunto Privado Sector Marianitas-Buenaventura;Casa; 55000;Calderón, Norte De Quito;21/marzo/2020;;;
Venta Casa Dentro De Conjunto, Sector Rancho San Francisco;Casa; 355000;Nayon - Tanda, Valle Tumbaco;16/marzo/2020;;;
Casa De Venta Sur De Quito, Terminal Terrestre De Guamaní;Casa; 83000;Turubamba, Sur De Quito;21/marzo/2020;;;
Por Viaje: Vendo / Rento Apartamento 3 Dormitorios - Terraza - 2 Parqueos - Quito Tennis;Departamentos; 195000;Rumipamba, Centro Norte;12/marzo/2020;;;
Casa En Venta, Conjunto Privado / San Juan De Cumbayá;Casa; 220000;Cumbaya, Valle Tumbaco;10/marzo/2020;;;
Vendo Hermosa Casa Con Terreno - La Morita - Tumbaco;Casa; 690000;Tumbaco, Valle Tumbaco;19/marzo/2020;;;
Casa De Venta En Carapungo;Casa; 80000;Carapungo, Calderón, Norte De Quito;19/marzo/2020;;;
Casa De Venta, Armenia, 183 M2, Urbanización Cerrada $156000;Casa; 139500;Conocoto, Valle Los Chillos;14/marzo/2020;;;
Vendo Hermosa Casa En Cumbaya;Casa; 250000;Cumbaya, Valle Tumbaco;10/marzo/2020;;;
Venta Suite Sector Av. De Los Granados;Departamentos; 45000;Jipijapa, Centro Norte;10/marzo/2020;;;
Casas De Venta En Llano Chico;Casa; 69990;Llano Chico, Norte De Quito;18/marzo/2020;;;
Vendo Casa Norte De Quito, El Condado;Casa; 278000;Cotocollao, Norte De Quito;10/marzo/2020;;;
Amplia Casa, Sector Colegio Einstein 229m;Casa; 129000;Carcelen, Norte De Quito;18/marzo/2020;;;
Departamento En Venta 2 Dormitorios Oportunidad;Departamentos; 83000;Rumipamba, Centro Norte;10/marzo/2020;;;
Venta Casa, Sector Amagasi Del Inca, Embajada Americana, Colegio Sek;Casa; 150000;Kennedy, Centro Norte;16/marzo/2020;;;
Venta Departamento Sector Kennedy;Departamentos; 125000;Kennedy, Centro Norte;16/marzo/2020;;;
Casa De Venta En Conjunto 170 M Sector Colegio Sek Cerca Embajda Americana, 3 Habitaciones,2 Parqueaderos Independientes;Casa; 175000;San Isidro Del Inca, Centro Norte;11/marzo/2020;;;
Amplia Casa De 4 Dormitorios Y Gran Jardin, Cerca Del Rancho San Francisco. Por Viaje Se Bajan Precio , Gran Oportunidad;Casa; 420000;Puengasí, Centro Colonial;15/marzo/2020;;;
Vendo Casa De Oportunidad Sector Solanda ,Barrio Alvaro Perez, Cerca Mercado Mayorista;Casa; 60000;Solanda, Sur De Quito;10/marzo/2020;;;
Ultimo Dpto En Venta De 105 M2 Granda Centeno;Departamentos; 163000;Granda Centeno, Rumipamba, Centro Norte;10/marzo/2020;;;
Lindo Departamento De Venta República Del Salvador Sector Carolina/D.D.;Departamentos; 115000;Kennedy, Centro Norte;10/marzo/2020;;;
Vendo Departamento Tres Dormitorios En Carolina;Departamentos; 290000;Iñaquito, Centro Norte;14/marzo/2020;;;
Vendo Hermoso Departamento En 23 De Junio Condado;Departamentos; 98500;Cotocollao, Norte De Quito;10/marzo/2020;;;
Venta Dpto Duplex Gonzalez Suarez;Departamentos; 183000;Gonzalez Suarez, Iñaquito, Centro Norte;13/marzo/2020;;;
Hermosas Casas A Estrenar Conjunto Bricanto Tumbaco;Casa; 145000;Tumbaco, Valle Tumbaco;13/marzo/2020;;;
Casa De Venta Oportunidad Al Norte De Quito - Calderon;Casa; 198000;Calderón, Norte De Quito;13/marzo/2020;;;
Puembo, Hermosa Casa En Conjunto Privado. Por Estrenar;Casa; 140000;Puembo, Valle Tumbaco;13/marzo/2020;;;
Casa Venta Colegio San Gabriel / Granda Centeno / Rumipamba, 4 Dormitorios, 311 M2 Construcción, 390 M2 Terreno Vivienda;Casa; 335000;Rumipamba, Centro Norte;10/marzo/2020;;;
Hermosa Casa De Venta 249,74m2 / $210,000 O Renta $1200 - Sector San Juan De Cumbaya;Casa; 210000;Cumbaya, Valle Tumbaco;10/marzo/2020;;;
Departamento En Luluncoto, Excelente Estado;Departamentos; 65000;Puengasí, Centro Colonial;10/marzo/2020;;;
Departamento En Venta - Sector Udla;Departamentos; 155000;El Inca, Jipijapa, Centro Norte;10/marzo/2020;;;
Venta Departamento 3 Dormitorios 182mts Sector Whymper, La Carolina;Departamentos; 180000;Iñaquito, Centro Norte;11/marzo/2020;;;
Vendo Casa En Cumbayá, Conjunto Cerrado, 248 M2 De Construcción, Seguridad 24h, Excelente Ubicación. Ruta Viva;Casa; 295000;Cumbaya, Valle Tumbaco;11/marzo/2020;;;
Vendo Tumbaco Departamento 2 Dormitorios/La Ceramica, Moderno, Vista;Departamentos; 135000;Tumbaco, Valle Tumbaco;10/marzo/2020;;;
Amplio Departamento En Venta, Sector Av. América Y Las Casas;Departamentos; 110000;Belisario Quevedo, Centro Norte;10/marzo/2020;;;
Venta Departamento Cumbaya;Departamentos; 328283;Cumbaya, Valle Tumbaco;10/marzo/2020;;;
Casa De 2 Pisos En Venta En Los Chillos Oxcv20021;Casa; 222000;Conocoto, Valle Los Chillos;10/marzo/2020;;;
Se Venne De Casa Amplia De 234 M² Cerca De La Real Audiencia 4 Habitaciones;Casa; 170000;Ponceano, Norte De Quito;10/marzo/2020;;;
Venta Departamento 3 Dormitorios En Edificios Tierra Alta, El Bosque;Departamentos; 176480;Cochapamba, Centro Norte;10/marzo/2020;;;
Hermoso Loft Granda Centeno;Departamentos; 78900;Rumipamba, Centro Norte;10/marzo/2020;;;
Venta De Casas A Estrenar Dentro De Conjunto Privado En Capelo–Valle De Los Chillos–Sector Sangolquí Cerca De San Rafael;Casa; 85000;Quito;10/marzo/2020;;;
Casa Estilo Rústico De 102.41 M2 En 2 Plantas;Casa; 70000;Calderón, Norte De Quito;10/marzo/2020;;;
Se Vende Casa Con 1700m2 De Terreno En San Juan De Cumbaya;Casa; 340000;Cumbaya, Valle Tumbaco;10/marzo/2020;;;
Casa De Venta Ubicada En Pinar De La Sierra, Conocoto;Casa; 83000;Conocoto, Valle Los Chillos;09/marzo/2020;;;
Se Vende Casa Grande Rentera En Remodelacion Sur, Sector San Diego, Negociable;Casa; 140000;Centro De Quito, Centro Colonial;10/marzo/2020;;;
Venta Departamento Sector Udla, Granados, Centro Norte, Uio;Departamentos; 65000;El Inca, Jipijapa, Centro Norte;10/marzo/2020;;;
Mirasierra-Valle De Los Chillos Departamento 2 Dormitorios Por Estrenar En Venta;Departamentos; 84252;Alangasí, Valle Los Chillos;10/marzo/2020;;;
Cumbaya, La Primavera 1, Suite De Venta En Edificio Moderno;Departamentos; 120000;Cumbaya, Valle Tumbaco;10/marzo/2020;;;
Casa O Departamento De Campo En Pakakuna Gardens Unico Y Hermoso Proyecto En Checa, Rodeado De Naturaleza Y Spa;Departamentos; 245000;Checa, Valle Tumbaco;10/marzo/2020;;;
Vendo Hermosa Casa Esquinera Cj. Alcazar De Burgos;Casa; 108000;Pomasqui, Norte De Quito;10/marzo/2020;;;
Venta De Casa Nueva Aplica Biess Valle De Los Chillos;Casa; 165000;Quito;10/marzo/2020;;;
Departamentos Sector Solca, Embajada Americana, Urb. Jardines De Amagasí, Colegio Sek;Departamentos; 103330;San Isidro Del Inca, Centro Norte;10/marzo/2020;;;
Casa De Venta Sector Real Audiencia El Rosario;Casa; 79500;Ponceano, Norte De Quito;10/marzo/2020;;;
Venta Hermoso Penthouse 3 Dorm. Excelente Ubicación.;Departamentos; 120000;El Batan, Iñaquito, Centro Norte;10/marzo/2020;;;
Departamento 3 Dorm. De Venta - Sector Udla / Centro Norte;Departamentos; 130000;El Inca, Jipijapa, Centro Norte;10/marzo/2020;;;
Departamento Vendo O Cambio Quito Tenis;Departamentos; 214000;Rumipamba, Centro Norte;10/marzo/2020;;;
Hermoso Departamento De Venta Frente A Ism Precio Negociable;Departamentos; 109000;San Isidro Del Inca, Centro Norte;10/marzo/2020;;;
Venta Departamento 2 Dormit. $ 69.000 E. Alfaro Y Los Laureles;Departamentos; 69000;Monteserrin, Jipijapa, Centro Norte;10/marzo/2020;;;
Venta De Casa Sector Bellavista;Casa; 200000;Bellavista, Iñaquito, Centro Norte;10/marzo/2020;;;
Venta De Casa Independiente En Conocoto En La Urbanización San Jose Del Valle De Los Chillos;Casa; 310000;Conocoto, Valle Los Chillos;10/marzo/2020;;;
Departamento De Venta, Norte De Quito, Sector Amazanas Y Colon;Departamentos; 114500;Mariscal Sucre, Centro Norte;10/marzo/2020;;;
Vendo Departamento, Gonzalez Suarez;Departamentos; 230000;Gonzalez Suarez, Iñaquito, Centro Norte;07/04/2020;;;
Cerca A La Carolina;Departamentos; 167000;Iñaquito, Centro Norte;10/marzo/2020;;;
Casas San Rafael Cerca Espe;Casa; 150000;Quito;10/marzo/2020;;;
Venta Departamento Sector Eloy Alfaro;Departamentos; 90000;Iñaquito, Centro Norte;10/marzo/2020;;;
Carapungo, $78.000, Vendo Casa 200m2 , 2 Plantas, Con Un Frente A La Via Principal;Casa; 78000;Iñaquito, Centro Norte;10/marzo/2020;;;
Departamento De Venta Calderón;Departamentos; 68055;Calderón, Norte De Quito;10/marzo/2020;;;
Departamento De 2 Dormitorios Sector Gonzalez Suarez;Departamentos; 182197;Gonzalez Suarez, Iñaquito, Centro Norte;10/marzo/2020;;;
Casa De Lujo De Venta En Cumbayá Cerca De La Usfq - Paseo San Francisco;Casa; 475000;Cumbaya, Valle Tumbaco;10/marzo/2020;;;
Departamento En Venta, Ponceano Precio Reducido! - Wasi;Departamentos; 95000;Ponceano, Norte De Quito;27/marzo/2020;;;
Casa En Venta, Cumbayá;Casa; 1650000;Cumbaya, Valle Tumbaco;16/marzo/2020;;;
Departamentos Venta;Departamentos; 49900;Calderón, Norte De Quito;16/marzo/2020;;;
República De El Salvador 222;Departamentos; 118000
            $80 alicuota;La Carolina, Iñaquito, Centro Norte;10/diciembre/2019;;;
Casa Rentera En Obra Gris, Con Dos Departamentos Terminados;Casa; 60000;Ponceano, Norte De Quito;10/marzo/2020;;;
Casa Venta;Casa; 115000
            $60 alicuota;El Condado, Norte De Quito;22/febrero/2020;;;
Departamento En Venta, Sector Monteserrín, 184 Mts 2;Departamentos; 205000;Monteserrin, Jipijapa, Centro Norte;03/abril/2020;;;
Hermoso Departamento En Quito Tenis, Con Balcón, 3 Dormitorios;Departamentos; 170000;Rumipamba, Centro Norte;06/abril/2020;138;3;
Vendo Departamento. Vista Hermosa. Cotocollao;Departamentos; 120000;Cotocollao, Norte De Quito;06/abril/2020;;;
Venta El Bosque Carvajal Y Brasil,Oportunidad Casa En Venta;Casa; 480000;Rumipamba, Centro Norte;14/marzo/2020;;;
Excelente Casa En Venta Sector Ponceano Norte De Quito En La Mercedes Gonzalez Y Alberto Einstein;Casa; 240000;Ponceano, Norte De Quito;27/marzo/2020;;;
C/ González Suárez, Departamento De 210m2 En Venta, 3 Habitaciones;Departamentos; 238000;Gonzalez Suarez, Iñaquito, Centro Norte;07/04/2020;;;
Cumbaya Dos Departamentos A Estrenar - Sector Urbanización Auqui Chico;Departamentos; 588587;Cumbaya, Valle Tumbaco;04/abril/2020;;;
Venta De Oportunidad - Quinta De Venta, 4 Dormitorios De Lujo, Sector Yanahuaico, Vía Amaguaña;Casa; 580000;Amaguaña, Sur De Quito;13/marzo/2020;;;
402 Quito Tenis. Vendo Departamento 75 Metros De 2 Dormitorios Con Balcón. A Estrenar;Departamentos; 140000;Rumipamba, Centro Norte;04/abril/2020;;;
Departamento De Venta, Norte De Quito, Colegio Einstein,;Departamentos; 110000;La Concepcion, Concepción, Centro Norte;03/abril/2020;;;
Departamento De Venta En El Quito Tenis;Departamentos; 260000;Rumipamba, Centro Norte;03/abril/2020;;;
Vendo Departamento Sector El Bosque;Departamentos; 138000;Cochapamba, Centro Norte;02/abril/2020;;;
Oportunidad!!! Hermosa Quinta Con Casa Y Construcción Adicional, A 2 Min Del Parque Metropolitano De La Armenia;Casa; 480000;Conocoto, Valle Los Chillos;02/abril/2020;;;
Casa De Venta En Tumbaco, Sector Ruta Viva, Amplio Jardin.;Casa; 174000;Tumbaco, Valle Tumbaco;10/marzo/2020;;;
Iñaquito Alto Vendo/ Rento Departamento;Departamentos; 135000;Iñaquito Alto, Rumipamba, Centro Norte;10/marzo/2020;;;
Vendo Espectacular Departamento Norte De Quito;Departamentos; 148000;San Isidro Del Inca, Centro Norte;31/marzo/2020;;;
Casa De Venta En Amaguaña, Conjunto Privado;Casa; 170000;Amaguaña, Sur De Quito;16/marzo/2020;;;
Venta Hermoso Departamento 2 Dormitorios. Sector El Batan / Norte De Quito;Departamentos; 120000;Iñaquito, Centro Norte;22/marzo/2020;;;
Se Vende Acogedor Departamento Sector Norte Solca 116m²;Departamentos; 78000;San Isidro Del Inca, Centro Norte;10/marzo/2020;;;
Espectacular Casa De Venta En Tumbaco;Casa; 230000;Tumbaco, Valle Tumbaco;30/marzo/2020;;;
Venta Casa Santa Lucía 208 Mts. 3 Dormitorios;Casa; 135000;Kennedy, Centro Norte;30/marzo/2020;;;
Moderna Y Bonita Casa Nueva - La Viña;Casa; 600000;Tumbaco, Valle Tumbaco;19/marzo/2020;;;
Casa Conjunto La Cascada, Iñaquito Alto, Usd269.000;Casa; 269000;Quito Tenis, Centro Norte;17/marzo/2020;;;
Vendo Depatamento De Dos Dormitorios En La Carolina;Departamentos; 189900;Iñaquito, Centro Norte;10/marzo/2020;;;
Venta Casa Oportunidad La Armenia - Los Chillos;Casa; 168000;Conocoto, Valle Los Chillos;29/marzo/2020;;;
Venta De Departamento, Dos Habitaciones. Sector La Carolina;Departamentos; 100000;Iñaquito, Centro Norte;29/marzo/2020;;;
Vendo Hermosos Departamentos Por Estrenar En Edificio , Acabados De Lujo Sector El Inca;Departamentos; 137000;Kennedy, Centro Norte;28/marzo/2020;;;
Casa De Venta Tumbaco 4 Habitaciones Jardín;Casa; 300000;Tumbaco, Valle Tumbaco;31/marzo/2020;;;
Casa En Venta En La Armenia Ii, Puente 8;Casa; 179000;Conocoto, Valle Los Chillos;19/marzo/2020;;;
Casa Venta, Conjunto La Campiña, Entre Escu. Militar Y Escu De Policía;Casa; 240000;El Condado, Norte De Quito;27/marzo/2020;;;
Venta De Casa Independiente Y Con Terreno, En Urbanización Cerrada, 4 Alcobas Y 4 Estacionamientos;Casa; 270000;Quito;26/marzo/2020;;;
Ganga! Vendo Casa Quito Tenis $220.000;Casa; 220000;Rumipamba, Centro Norte;19/marzo/2020;;;
Casa De Venta En Quito En Conocoto Valle De Los Chillos Cod: V066;Casa; 189000;Conocoto, Valle Los Chillos;25/marzo/2020;;;
Venta O Renta Departamento 3 Hab 2 Baños (90 M²) 1 Parqueadero Ponceano Alto.;Departamentos; 109000;Ponceano, Norte De Quito;24/marzo/2020;;;
Venta De Penthouse Con Línea Blanca Por Estrenar;Departamentos; 348000;El Condado, Norte De Quito;23/marzo/2020;;;
Venta Departamento En Ponceano;Departamentos; 142000;Ponceano, Norte De Quito;23/marzo/2020;;;
Venta Casa Independiente Carapungo Frente Municipio Calderón, Gran Aki;Casa; 89000;Calderón, Norte De Quito;23/marzo/2020;;;
Departamento En Venta Quito/ Llano Grande/ Calderón 100% Biess;Departamentos; 75900;Calderón, Norte De Quito;22/marzo/2020;;;
Casa En Venta En San Isidro Del Inca/ 3 Dormitorios En Conjunto Privado;Casa; 124000;San Isidro Del Inca, Centro Norte;27/marzo/2020;;;
Hermosa Casa De Venta En Tumbaco 150 M2 Hab, 2.720 M2 Terrenoen Sector Exclusivo.;Casa; 320000;Tumbaco, Valle Tumbaco;10/marzo/2020;;;
Vendo Suite Por Estrenar/ Sector La Carolina;Departamentos; 95900;Iñaquito, Centro Norte;07/04/2020;;;
Suite En Venta Junto Al Swiss Hotel;Departamentos; 80000;Mariscal Sucre, Centro Norte;04/abril/2020;;;
Vendo Casas De 2 Pisos En Marianitas Aplica Crédito Vip;Casa; 69900;Calderón, Norte De Quito;10/marzo/2020;;;
Se Vende Casa Pusuqui;Casa; 105000;Pomasqui, Norte De Quito;20/marzo/2020;;;
En Venta Casa Tres Pisos En Conjunto Privado Alexina “2”-Carcelen-Carretas;Casa; 115000;Carcelen, Norte De Quito;19/marzo/2020;;;
Casa De Venta En Carcelén, Urbanización Privada - Seguridad Permanente - Norte De Quito;Casa; 160000;Carcelen, Norte De Quito;10/marzo/2020;;;
Casa De Venta Valle De Los Chillos;Casa; 300000;Calderón, Norte De Quito;31/marzo/2020;;;
Casa Estilo Rustico Remodelada Ponceano;Casa; 198500;Ponceano, Norte De Quito;18/marzo/2020;;;
Vendo Amplio Departamento Sector San Isidro Del Inca;Departamentos; 85000;San Isidro Del Inca, Centro Norte;10/marzo/2020;;;
Vendo Casa Por Estrenar;Casa; 120000;Calderón, Norte De Quito;12/marzo/2020;;;
Venta Casa Rentera Soleada Bien Ubicada Zona Comercial Residencial;Casa; 300000;Belisario Quevedo, Centro Norte;15/marzo/2020;;;
Cxc Venta Departamento, Carcelen, Norte De Quito, Exp. 2430;Departamentos; 74000;Belisario Quevedo, Centro Norte;14/marzo/2020;;;
Venta Departamento 3 Dormitorios, 120m2 Carcelén;Departamentos; 92000;Carcelen, Norte De Quito;10/marzo/2020;;;
Espectacular Casa En Venta, 413 M2 Sector El Condado;Casa; 274900;El Condado, Norte De Quito;10/marzo/2020;;;
Seguro Departamento En Tumbaco;Departamentos; 139000;Tumbaco, Valle Tumbaco;10/marzo/2020;;;
Be/ El Recreo - Se Vende Hermosa Casa 500 M2 Cod. Ca - 00104;Casa; 298000;San Bartolo, Sur De Quito;23/marzo/2020;;;
La Kennedy, Casa Rentera, 517 M2, 4 Departamentos, 1 Local, 3 Parqueaderos;Casa; 330000;Kennedy, Centro Norte;10/marzo/2020;;;
Se Vende Casa Valle Los Chillos Puente 9 Armenia;Casa; 179000;Conocoto, Valle Los Chillos;29/marzo/2020;;;
Casa De Venta,Sector Colegio De La Liga Urb.Liga Cod 105-5;Casa; 100000;Pomasqui, Norte De Quito;10/marzo/2020;;;
Edificio Ecoeficiente De Suite 1 Dorm. Shyris;Departamentos; 96900;Iñaquito, Centro Norte;10/marzo/2020;;;
Venta Casas Calderon Norte De Quito;Casa; 93000;Puengasí, Centro Colonial;10/marzo/2020;;;
Venta De Casa Rentera 3ra Etapa Sector Carapungo, Norte De Quito;Casa; 122000;Carapungo, Calderón, Norte De Quito;10/marzo/2020;;;
Departamento En Venta Ponceano 3 Dormitorios, 3 Parqueos;Departamentos; 125000;Ponceano, Norte De Quito;10/marzo/2020;;;
Vendo Departamento Sector Quito Tenis;Departamentos; 68000;Bellavista, Iñaquito, Centro Norte;10/marzo/2020;;;
Vendo Departamento 101 M2 Sector El Eden;Departamentos; 83000;San Isidro Del Inca, Centro Norte;10/marzo/2020;;;
Casa De Venta Con Terreno Para Construir / Ponciano Alto- Norte Quito;Casa; 270000;Ponceano, Norte De Quito;10/marzo/2020;;;
