NOMBRE_CONJUNTO;TIPO_BIEN;PRECIO;LOCALIZACIÓN;FECHA_PUBLICACIÓN;ÁREA m²;NUM_HABITACIONES;NOMBRE_PROYECTO
Residencias Araguaney;Casa; 71100;Mitad Del Mundo, Norte De Quito;17/febrero/2020;87;3;VIP
Casantos;Casa; 77990;La Armenia I, Conocoto, Valle Los Chillos;05/marzo/2020;134;3;Proyecto inmobiliario
Conjunto Armenia Gardens;Casa; 119817;Puente 3, La Armenia I, Conocoto, Valle Los Chillos;02/diciembre/2019;123;3;Proyecto inmobiliario
El Retablo;Casa; 180000;Valle Tumbaco;29/octubre/2019;172;3;Proyecto inmobiliario
Conjunto Residencial Campo Grande;Departamentos; 130000;Tumbaco, Valle Tumbaco;06/septiembre/2019;123;3;Proyecto inmobiliario
Cumbres Del Condado;Lote; 24500;El Condado, Norte De Quito;12/diciembre/2019;;;VIP
Al Parque Casas Y Jardínes;Casa; 214000;Tumbaco, Valle Tumbaco;02/abril/2020;235;3;Proyecto inmobiliario
Seis Suites: Departamentos. Suite Precio Desde:;Departamentos; 58354;La Carolina, Iñaquito, Centro Norte;08/abril/2020;35;1;Proyecto inmobiliario
Casa Club Pinsaqui;Departamentos; 69500;Quitumbe, Sur De Quito;13/febrero/2020;;3;VIP
La Cayetana;Casa; 110036;Valle Tumbaco;16/enero/2020;89;3;Proyecto inmobiliario
Bönn: Departamentos. Suite;Departamentos; 94475;Granda Centeno, Rumipamba, Centro Norte;03/marzo/2020;65;1;Proyecto inmobiliario
Versailles;Departamentos; 100000;Cumbaya, Valle Tumbaco;06/enero/2020;87;1;Proyecto inmobiliario
Docamar;Departamentos; 124400;Amagasi Del Inca, Norte De Quito;07/abril/2020;101;3;Proyecto inmobiliario
Calma;Casa; 72990;Llano Chico, Norte De Quito;18/marzo/2020;83;3;VIP
Treviso;Casa; 74850;La Armenia I, Conocoto, Valle Los Chillos;02/marzo/2020;;3;Proyecto inmobiliario
Terrenos Prados Del Este, San Rafael;Lote; 74900;Valle Los Chillos;10/marzo/2020;;;Proyecto inmobiliario
Saint Mathew: Departamentos. Suite Suite Patio De 20 M2 Precio Promocional;Departamentos; 81000;Iñaquito Alto, Rumipamba, Centro Norte;12/septiembre/2019;45;1;Proyecto inmobiliario
Paseo De Los Algarrobos;Lote; 19200;Guayllabamba, Norte De Quito;21/febrero/2020;;;Proyecto inmobiliario
Conjunto Lucía;Casa; 202356;Norte De Quito;03/marzo/2020;159;3;Proyecto inmobiliario
Guetti;Departamentos; 233557;Granda Centeno, Rumipamba, Centro Norte;11/febrero/2020;130;3;Proyecto inmobiliario
Amahru: Loft / Estudio. Estudio No. 407. + Bodega;Loft / Estudio; 86661;Colinas Del Pichincha, Rumipamba, Centro Norte;11/febrero/2020;49;1;Proyecto inmobiliario
Conjunto La Quinta;Casa; 120000;Valle Los Chillos;10/enero/2020;135;3;Proyecto inmobiliario
Casal Robles;Departamentos; 79335;Mariscal Sucre, Centro Norte;23/marzo/2020;44;1;Proyecto inmobiliario
Ph Luxury Apartments;Departamentos; 182196;Gonzalez Suarez, Iñaquito, Centro Norte;28/enero/2020;93;2;Proyecto inmobiliario
Vessant;Casa; 367000;Cumbaya, Valle Tumbaco;30/septiembre/2019;244;3;Proyecto inmobiliario
Conjunto Residencial Campo Grande;Casa; 180000;Tumbaco, Valle Tumbaco;06/septiembre/2019;163;3;Proyecto inmobiliario
Valle Cartago;Casa; 137500;La Armenia I, Conocoto, Valle Los Chillos;02/marzo/2020;;3;Proyecto inmobiliario
Killari;Departamentos; 127670;Monteserrin, Jipijapa, Centro Norte;04/febrero/2020;86;2;Proyecto inmobiliario
Edificio Toquilla: Departamentos. Suite Torre A. Dptos 201,301 Y 401 + Incluye Bodega Y Terraza De 7,45m2;Departamentos; 73304;Monteserrin, Jipijapa, Centro Norte;13/enero/2020;42;1;Proyecto inmobiliario
Belorizonte 3;Departamentos; 69000;Ponceano, Norte De Quito;25/octubre/2019;59;1;Proyecto inmobiliario
Edificio Estrella VIII;Departamentos; 164927;La Carolina, Iñaquito, Centro Norte;30/marzo/2020;142;3;Proyecto inmobiliario
Torre Borealis;Local; 88430;El Bosque, Cochapamba, Centro Norte;19/marzo/2020;;;Proyecto inmobiliario
Monticello;Departamentos; 198646;Nayon - Tanda, Valle Tumbaco;18/marzo/2020;155;3;Proyecto inmobiliario
Auki;Departamentos; 182650;Cumbaya, Valle Tumbaco;03/marzo/2020;124;3;Proyecto inmobiliario
Mirador Del Valle;Departamentos; 66700;La Armenia I, Conocoto, Valle Los Chillos;02/marzo/2020;;3;Proyecto inmobiliario
Faz Homes;Local; 81260;Granda Centeno, Rumipamba, Centro Norte;04/febrero/2020;;;Proyecto inmobiliario
Casal Robles;Local; 94321;Mariscal Sucre, Centro Norte;23/marzo/2020;;;Proyecto inmobiliario
Porton De Malaga 2;Casa; 74500;Pomasqui, Norte De Quito;13/febrero/2020;;3;VIP
Edificio Toquilla;Local; 69210;Monteserrin, Jipijapa, Centro Norte;13/enero/2020;;;Proyecto inmobiliario
Faz Homes;Departamentos; 106758;Granda Centeno, Rumipamba, Centro Norte;04/febrero/2020;;;Proyecto inmobiliario
Edificio Estrella VIII;Oficina / Consultorio; 228532;La Carolina, Iñaquito, Centro Norte;30/marzo/2020;;;Proyecto inmobiliario
Zagaleta;Lote; 208000;Puembo, Valle Tumbaco;07/abril/2020;;;Proyecto inmobiliario
Portal Del Lago;Casa; 135575;La Armenia Ii, Conocoto, Valle Los Chillos;19/febrero/2020;123;3;Proyecto inmobiliario
Porton De Malaga 2;Departamentos; 69000;Pomasqui, Norte De Quito;13/febrero/2020;;3;VIP
Edificio David;Departamentos; 134000;El Condado, Norte De Quito;26/febrero/2020;;3;Proyecto inmobiliario
Edge: Departamentos. Suite Suite + Balcón 2,70 M2;Departamentos; 120663;La Carolina, Iñaquito, Centro Norte;24/enero/2020;59;1;Proyecto inmobiliario
Amahru;Departamentos; 143869;Colinas Del Pichincha, Rumipamba, Centro Norte;11/febrero/2020;87;2;Proyecto inmobiliario
Vessant;Departamentos; 135000;Cumbaya, Valle Tumbaco;30/septiembre/2019;61;1;Proyecto inmobiliario
Seis;Departamentos; 162578;La Carolina, Iñaquito, Centro Norte;08/abril/2020;85;2;Proyecto inmobiliario
Torre Borealis: Departamentos. Suite Tercer Piso + Bodega Y Parqueadero;Departamentos;;El Bosque, Cochapamba, Centro Norte;19/marzo/2020;47;1;Proyecto inmobiliario
Livorno;Casa; 110000;Puembo, Valle Tumbaco;13/febrero/2020;;3;Proyecto inmobiliario
Edificio Andalucía;Departamentos; 128220;Andalucía, Norte De Quito;12/febrero/2020;88;2;Proyecto inmobiliario
Bronte;Departamentos; 100831;La Carolina, Iñaquito, Centro Norte;28/enero/2020;54;1;Proyecto inmobiliario
Terrazas Sfera II;Departamentos; 151300;Monteserrin, Jipijapa, Centro Norte;30/enero/2020;;2;Proyecto inmobiliario
Bosques De Amaru;Departamentos; 70000;Quitumbe, Sur De Quito;12/marzo/2020;72;3;VIP
Bronte;Oficina / Consultorio; 137331;La Carolina, Iñaquito, Centro Norte;28/enero/2020;;;Proyecto inmobiliario
El Belén Terrenos;Lote; 21250;Cutuglagua, Sur De Quito;12/marzo/2020;;;Proyecto inmobiliario
Parque La Viña;Casa; 412545;Tumbaco, Valle Tumbaco;05/febrero/2020;371;3;Proyecto inmobiliario
Venetto;Departamentos; 155000;Ponceano, Norte De Quito;02/julio/2019;;3;Proyecto inmobiliario
Edificio Andalucía;Local; 67606;Andalucía, Norte De Quito;12/febrero/2020;;;Proyecto inmobiliario
Bronte;Local; 277996;La Carolina, Iñaquito, Centro Norte;28/enero/2020;;;Proyecto inmobiliario
Sense: Departamentos. Suite;Departamentos; 107000;La Carolina, Iñaquito, Centro Norte;14/febrero/2020;55;1;Proyecto inmobiliario
Viña Del Este;Casa; 255142;Tumbaco, Valle Tumbaco;29/enero/2020;234;3;Proyecto inmobiliario
Jardínes De La Colina;Casa; 94900;Conocoto, Valle Los Chillos;09/octubre/2019;105;3;Proyecto inmobiliario
Viña Del Este;Departamentos; 209172;Tumbaco, Valle Tumbaco;29/enero/2020;144;2;Proyecto inmobiliario
Kintu;Casa; 85000;Calderón, Norte De Quito;31/marzo/2020;93;3;VIP
Le Parc.;Departamentos; 150000;Jipijapa, Centro Norte;01/octubre/2019;135;3;Proyecto inmobiliario
Home Nius;Casa; 94900;Mitad Del Mundo, Norte De Quito;18/octubre/2019;113;3;Proyecto inmobiliario
Terra Plus;Departamentos; 92633;El Batan, Iñaquito, Centro Norte;30/agosto/2019;35;1;Proyecto inmobiliario
Huma: Departamentos. Suite Pisos 2 / 3 / 7;Departamentos; 130674;La Carolina, Iñaquito, Centro Norte;13/febrero/2020;;1;Proyecto inmobiliario
Castejón;Departamentos; 226882;Cumbaya, Valle Tumbaco;18/febrero/2020;;2;Proyecto inmobiliario
Dacar;Casa; 53859;Calderón, Norte De Quito;10/octubre/2019;58;2;Proyecto inmobiliario
Gardens Club 3;Casa; 70000;Calderón, Norte De Quito;05/julio/2019;85;3;VIP
Mont Blanc;Departamentos; 54406;Conocoto, Valle Los Chillos;05/julio/2019;65;2;Proyecto inmobiliario
Estrella X;Departamentos; 87932;El Batan, Iñaquito, Centro Norte;10/febrero/2020;52;1;Proyecto inmobiliario
Ílios;Departamentos; 256289;Cumbaya, Valle Tumbaco;17/enero/2020;155;2;Proyecto inmobiliario
Estrella IX;Departamentos; 157715;Gonzalez Suarez, Iñaquito, Centro Norte;10/febrero/2020;92;2;Proyecto inmobiliario
Arbat;Departamentos; 166553;La Carolina, Iñaquito, Centro Norte;11/febrero/2020;83;2;Proyecto inmobiliario
Artemis;Departamentos; 110000;La Carolina, Iñaquito, Centro Norte;17/octubre/2019;49;1;Proyecto inmobiliario
Portimao;Oficina / Consultorio; 147430;La Carolina, Iñaquito, Centro Norte;16/diciembre/2019;;;Proyecto inmobiliario
Sense;Oficina / Consultorio; 100336;La Carolina, Iñaquito, Centro Norte;14/febrero/2020;;;Proyecto inmobiliario
Vitoria II;Departamentos; 219239;La Carolina, Iñaquito, Centro Norte;02/septiembre/2019;117;3;Proyecto inmobiliario
Zyra;Oficina / Consultorio; 131522;La Carolina, Iñaquito, Centro Norte;15/noviembre/2019;;;Proyecto inmobiliario
Torres Del Bosque;Departamentos; 174650;El Bosque, Cochapamba, Centro Norte;31/marzo/2020;83;2;Proyecto inmobiliario
Edificio Antalya: Departamentos. Dúplex;Departamentos; 211323;Quito Tenis, Centro Norte;31/marzo/2020;118;3;Proyecto inmobiliario
Torre Centre;Oficina / Consultorio; 184535;La Carolina, Iñaquito, Centro Norte;02/septiembre/2019;;;Proyecto inmobiliario
Torre Centre;Local; 383282;La Carolina, Iñaquito, Centro Norte;02/septiembre/2019;;;Proyecto inmobiliario
Vitoria II;Local; 183564;La Carolina, Iñaquito, Centro Norte;02/septiembre/2019;;;Proyecto inmobiliario
Zaigen;Oficina / Consultorio; 67104;El Batan, Iñaquito, Centro Norte;15/noviembre/2019;;;Proyecto inmobiliario
Calle Quiteño Libre Y Av. Ayarza 170516;Departamentos; 240000;Bellavista, Iñaquito, Centro Norte;27/marzo/2020;;;
Santa Lucai 6;Casa; 175000
            $80 alicuota;Ponceano, Norte De Quito;31/marzo/2020;;;
Casa Venta;Casa; 240000;La Concepcion, Concepción, Centro Norte;05/abril/2020;;;
Lote Venta;Lote; 1300000;Cumbaya, Valle Tumbaco;27/marzo/2020;;;
Departamentos Venta;Departamentos; 139000;Valle Tumbaco;16/marzo/2020;;;
Av .Interoceanica 24511;Casa; 980000
            $180 alicuota;Cumbaya, Valle Tumbaco;21/noviembre/2019;;;
Pasaje N82c Y Leonardo Freire 73;Casa; 200000;Carcelen, Norte De Quito;17/junio/2019;;;
Conjunto Terrazas De San José 57;Casa; 69900
            $25 alicuota;Carapungo, Calderón, Norte De Quito;12/septiembre/2019;;;
Casa Venta;Casa; 157000
            $70 alicuota;Tumbaco, Valle Tumbaco;21/febrero/2020;;;
Casa Venta;Casa; 215000
            $120 alicuota;Tumbaco, Valle Tumbaco;18/febrero/2020;;;
Departamentos Venta;Departamentos; 115000;Quito Tenis, Centro Norte;10/marzo/2020;;;
Marcos Jofre 984970485;Departamentos; 87000;Norte De Quito;05/noviembre/2019;;;
Casa Venta;Casa; 112000;Pomasqui, Norte De Quito;25/marzo/2020;;;
Casa En La Pampa, Venta, 5 Habitaciones;Penthouse; 340000;Pomasqui, Norte De Quito;06/abril/2020;500;5;
Casa Venta;Casa; 95999
            $72 alicuota;San Isidro Del Inca, Centro Norte;20/enero/2020;;;
Casa Venta;Casa; 92000;Pomasqui, Norte De Quito;20/enero/2020;;;
Venta Casa, Sector Colegio Alberto Einstein, Carcelen;Casa; 220000;Carcelen, Norte De Quito;12/04/2020;;;
Venta Departamento 3 Dormitorios, 120m2 Carcelén;Departamentos; 92000;Carcelen, Norte De Quito;11/abril/2020;;;
El Bosque, Unión Nacional Suite De Venta Con Balcòn;Departamentos; 79000;Iñaquito, Centro Norte;11/abril/2020;;;
Venta Departamento De 2 Dormitorios De 62m2 A Estrenar Norte De Quito;Departamentos; 75000;Cotocollao, Norte De Quito;10/abril/2020;;;
Vendo Departamento Amoblado Con Vista Al Mar. Tonsupa;Departamentos; 98000;Belisario Quevedo, Centro Norte;10/abril/2020;;;
Edificio Ecoeficiente De Suite 1 Dorm. Shyris;Departamentos; 96900;Iñaquito, Centro Norte;09/abril/2020;;;
Venta / Departamentos Sector Ruta Viva Cercano A Cumbaya Y Tumbaco;Departamentos; 149685;Cumbaya, Valle Tumbaco;08/abril/2020;;;
C/ Gonzalez Suarez, Suite De 69m2 En Venta, Terraza De 15,50m2;Departamentos; 243400;Gonzalez Suarez, Iñaquito, Centro Norte;07/abril/2020;;;
Casa En Pueblo Blanco 1;Casa; 83000;Calderón, Norte De Quito;07/abril/2020;;;
Excelente Departamento En Venta Centro Norte De Quito Calle Bosmediano Sector Bellavista;Departamentos; 440000;Bellavista, Iñaquito, Centro Norte;07/abril/2020;;;
Amplia Casa 6 Dorm., Sector Plaza Las Américas;Casa; 462000;Granda Centeno, Rumipamba, Centro Norte;06/abril/2020;;;
Vendo Departamento En Lomas De Monteserrín;Departamentos; 189000;Jipijapa, Centro Norte;06/abril/2020;;;
Venta, Hacienda En El Quinche,La Mejor Del Sector;Casa; 2626722;El Quinche, Valle Tumbaco;06/abril/2020;;;
Quito Departamento En Venta Gonzalez Suarez Semi Remodelado;Departamentos; 400000;Iñaquito, Centro Norte;05/abril/2020;;;
Casa Por Estrenar Chillos, Oferta Especial - Wasi;Casa; 128000;Conocoto, Valle Los Chillos;04/abril/2020;;;
2pa2cumbayá.La Primavera Ventadepart 113m 3 Dormitorios+Balcón7,64m;Departamentos; 199325;Cumbaya, Valle Tumbaco;04/abril/2020;;;
Hermosa Suite Por Estrenar Complejo Financiero Ekopark, Udla, Redondel Del Ciclista - Monteserrín;Departamentos; 125000;Iñaquito, Centro Norte;03/abril/2020;;;
Casa De Venta En El Sector De El Inca Cerca De De La Amazonas;Casa; 350000;Jipijapa, Centro Norte;03/abril/2020;;;
Vendo Departamento 2 Dorm Pinar Alto;Departamentos; 120000;El Pinar, Concepción, Centro Norte;02/abril/2020;;;
Casa Independiente Estilo Rustica, En Una Planta, De Venta Sector Conocoto;Casa; 140000;Conocoto, Valle Los Chillos;02/abril/2020;;;
Penthouse De Venta En Vista Grande. 3 Dormitorios, Terrazas, Vista Espectacular;Departamentos; 408000;Miravalle, Nayon - Tanda, Valle Tumbaco;01/abril/2020;;;
Lomas Moteserrin Oportunidad Departamento De Venta, Norte De Quito;Departamentos; 280000;Jipijapa, Centro Norte;01/abril/2020;;;
Vendo Departamento, Urbanización Amagasi Del Inca.;Departamentos; 158000;San Isidro Del Inca, Centro Norte;31/marzo/2020;;;
Departamento En Venta Sur De Quito, La Villaflora;Departamentos; 68000;La Magdalena, Sur De Quito;31/marzo/2020;;;
Venta Departamento 3 Dormitorios En Ponciano/ Norte De Quito;Departamentos; 60000;Ponceano, Norte De Quito;31/marzo/2020;;;
Se Vende Departamento 3 Habitaciones Sector Pomasqui;Departamentos; 59999;Pomasqui, Norte De Quito;30/marzo/2020;;;
Flamante Y Hermoso Departamento - Av. Occidental Y Legarda;Departamentos; 63806;Cochapamba, Centro Norte;30/marzo/2020;;;
Casa Una Sola Planta Con Hermosa Vista Al Valle - Viña Alta;Casa; 560000;Tumbaco, Valle Tumbaco;30/marzo/2020;;;
Departamento De Lujo Quiteño Libre Y Fernando Ayarza, Bellavista;Departamentos; 315000;Bellavista, Iñaquito, Centro Norte;30/marzo/2020;;;
Promoción San Valentin, Estrene Casa En San Camilo Al Norte De Quito;Casa; 125000;Calderón, Norte De Quito;30/marzo/2020;;;
Venta Suite Oportunidad La Floresta, Sector Universidades;Departamentos; 66000;Mariscal Sucre, Centro Norte;29/marzo/2020;;;
Venta De Departamento, Dos Habitaciones. Gaspar De Villarroel;Departamentos; 135000;Iñaquito, Centro Norte;29/marzo/2020;;;
Casa De Venta En Calderon Sector Carretas A 2 Minutos Del Portal Shopping . Oportunidad;Casa; 135000;Calderón, Norte De Quito;28/marzo/2020;;;
Tumbaco Casa Estilo Rústico 4 Habitaciones Jardín;Casa; 300000;Tumbaco, Valle Tumbaco;27/marzo/2020;;;
Casa En Venta Sector Uraba Ii, Cerca Intercambiador Carcelen O Intercambiador Carapungo;Casa; 120000;Carcelen, Norte De Quito;27/marzo/2020;;;
Casa De Venta En Los Chillos, San Rafael, Propiedad Con 350 M2 De Terreno Y 335 M2 De Construcción, 4 Dormitorios;Casa; 245000;Conocoto, Valle Los Chillos;27/marzo/2020;;;
Vendo Casa 2 Dptos + Galpón, San Fernando A 5 Cuadras Av. Occidental $398.000;Casa; 398000;Cochapamba, Centro Norte;26/marzo/2020;;;
Departamento En Venta En Quito Centro Norte En La Shyris Quicentro Cod: V083;Departamentos; 150000;Iñaquito, Centro Norte;25/marzo/2020;;;
Venta Departamento (Penthouse) 3 Hab 3.5 Baños 2 Parqueadero 1 Bodega (250 M²) - La Coruña;Departamentos; 390000;Iñaquito, Centro Norte;24/marzo/2020;;;
Vendo Casa En El Sector De San Fernando (Arriba De La Occidental);Casa; 145000;Cochapamba, Centro Norte;23/marzo/2020;;;
Venta De Casas Ene Nayon;Casa; 178548;Nayon - Tanda, Valle Tumbaco;23/marzo/2020;;;
Venta De Oportunidad Casa Independiente Carapungo I Etapa, Atras Supermercado Gran Aki.;Casa; 48000;Carapungo, Calderón, Norte De Quito;23/marzo/2020;;;
Casa En Venta/Arriendo Quito/ Tumbaco/ La Morita;Casa; 119900;Tumbaco, Valle Tumbaco;22/marzo/2020;;;
Casa De Venta En Nayon 3 Dormitorios En Urbanización Privada;Casa; 310000;Nayon - Tanda, Valle Tumbaco;22/marzo/2020;;;
Venta Hermosa Casa Sector Colegio Einstein Norte De Quito;Casa; 388000;Carcelen, Norte De Quito;22/marzo/2020;;;
Casa De Venta En Capelo, Cipreses, Valle De Los Chillos;Casa; 230000;Quito;21/marzo/2020;;;
Casa De Venta En San Marcos, Departamentos Y Locales, Centro De Quito, Centro Histórico, Rocafuerte Y Liceo;Casa; 350000;Centro De Quito, Centro Colonial;21/marzo/2020;;;
Vendo Casas En Proyecto San Juan De Calderón En 49.647;Casa; 51647;Calderón, Norte De Quito;21/marzo/2020;;;
Vendo Casa La Pampa;Casa; 340000;Pomasqui, Norte De Quito;20/marzo/2020;;;
Casa En Venta A Precio De Remate, Sector La Morenita, Calderóncalderón, Quito.;Casa; 73000;Calderón, Norte De Quito;19/marzo/2020;;;
Departamento De Venta Cerca A Embajada Americana, Norte De Quito, Guardianía Y Parqueadero. Centro Norte De Quito;Departamentos; 105000;Kennedy, Centro Norte;19/marzo/2020;;;
Nayon Propiedad De Venta Minimalista 700m2. Construccion 2700m2 De Terreno;Casa; 699000;Nayon - Tanda, Valle Tumbaco;18/marzo/2020;;;
Oportunidad Venta Depar 3 Dormitorios La Y;Departamentos; 92000;Rumipamba, Centro Norte;18/marzo/2020;;;
Vendo Departamento Amplio, Remodelado En Pb, Sector La Luz;Departamentos; 99000;La Luz, Kennedy, Centro Norte;17/marzo/2020;;;
Venta Departamento Penthouse De Lujo En Quito Tenis: Terraza 360 Amplia /Gimnasio/ Jardines;Departamentos; 620000;Rumipamba, Centro Norte;17/marzo/2020;;;
Casa Por Estrenar En Venta;Casa; 80000;Calderón, Norte De Quito;15/marzo/2020;;;
Cxc Venta Casa En Conjunto, La Merced, Valle, Exp. 4147;Casa; 53900;Belisario Quevedo, Centro Norte;14/marzo/2020;;;
Miguel Angel;Penthouse; 320000;Cumbaya, Valle Tumbaco;06/abril/2020;;3;
Casa Venta;Casa; 150000;La Armenia I, Conocoto, Valle Los Chillos;18/febrero/2020;;;
Departamento En Venta / Cne - La Carolina;Departamentos; 180000;Iñaquito, Centro Norte;11/abril/2020;;;
Casa Tres Dorm. Mas Patio, Cumbaya - Ruta Viva;Departamentos; 229000;Cumbaya, Valle Tumbaco;10/abril/2020;;;
Venta De Departamento Av. De La Republica;Departamentos; 139500;Rumipamba, Centro Norte;10/abril/2020;;;
Venta De Departamento Dúplex De 126m² Granda Centeno, Quito;Departamentos; 179000;Granda Centeno, Rumipamba, Centro Norte;10/abril/2020;;;
Dos Dptos. Por Estrenar. Sector Norte De Quito. Cerca A Bicentenario;Departamentos; 88000;Kennedy, Centro Norte;10/abril/2020;;;
Vendo Dpto. 172 M2 Bellavista;Departamentos; 163700;Bellavista, Iñaquito, Centro Norte;09/abril/2020;;;
En Venta Ultima Casa 125m2 - La Armenia;Casa; 110000;Conocoto, Valle Los Chillos;09/abril/2020;;;
Conjunto Farah;Casa; 112350;Zámbiza, Centro Norte;08/abril/2020;;;
Departamento Dos Hemisferios, 2 Dormitorios, Planta Baja, Con Mejoras, Seguridad, Canchas, A Solo 5 Minutos Del Condado;Departamentos; 50500;Pomasqui, Norte De Quito;08/abril/2020;;;
Me/Sector Quito Tenis Linda Suite En Venta!!!;Departamentos; 112000;Rumipamba, Centro Norte;08/abril/2020;;;
Casa De Venta, Rancho San Francisco, Cumbaya, Nayon;Casa; 210000;Nayon - Tanda, Valle Tumbaco;08/abril/2020;;;
Hermosa Casa Playa Las Palmas;Casa; 330000;Cumbaya, Valle Tumbaco;08/abril/2020;;;
Casa De Venta En Conocoto, Ubicada En Pinar De La Sierra;Casa; 83000;Conocoto, Valle Los Chillos;07/abril/2020;;;
Suite En Venta 70m2 Urbanización El Condado Edificio Nyon;Departamentos; 100266;El Condado, Norte De Quito;07/abril/2020;;;
Suite Con Patio Sector El Condado De Venta, Norte Quito;Departamentos; 54000;El Condado, Norte De Quito;07/abril/2020;;;
Suite De Venta Sector Carolina;Departamentos; 99968;Iñaquito, Centro Norte;07/abril/2020;;;
Vendo Casa Armenia Por Estrenar;Casa; 110000;Conocoto, Valle Los Chillos;07/abril/2020;;;
Casa De Venta En Vilcabamba Cerca Al Hospital De Calderon;Casa; 79900;Calderón, Norte De Quito;07/abril/2020;;;
Loft En Venta En El Sector De La Coruña Por Estrenar;Departamentos; 113360;Iñaquito, Centro Norte;07/abril/2020;;;
Departamento De Venta O Alquiler;Departamentos; 60000;Conocoto, Valle Los Chillos;07/abril/2020;;;
Casa De Venta Tonsupa A 100 Metros Del Malecon;Casa; 165000;Granda Centeno, Rumipamba, Centro Norte;07/abril/2020;;;
Casa De Venta En Calderon, Carapungo, Vía Marianitas, Llano Grande, Chico , Ism Calderón;Casa; 68000;Calderón, Norte De Quito;06/abril/2020;;;
Vendo Casa 120 Mtrs, 3 Dormitorios, Sector Amagasí Del Inca;Casa; 115000;San Isidro Del Inca, Centro Norte;06/abril/2020;;;
Venta De Casas De Oportunidad En El Valle De Tumbaco Sector Tola Grande Cerca De La Ruta Viva E Interoceánica;Casa; 130000;Tumbaco, Valle Tumbaco;06/abril/2020;;;
Hermosa Casa Con Piscina Urbanización 23 De Junio;Casa; 320000;El Condado, Norte De Quito;04/abril/2020;;;
Vendo Departamento Sector La Católica;Departamentos; 125000;Mariscal Sucre, Centro Norte;04/abril/2020;;;
Cumbaya - Vendo Casa;Casa; 355000;Cumbaya, Valle Tumbaco;04/abril/2020;;;
Vendo Departamento De 2 Dormitorios Sector Collaloma;Departamentos; 55000;Comité Del Pueblo, Centro Norte;04/abril/2020;;;
Separe Con Solo 500 Su Casa, Departamento O Local Comercial!!;Casa; 89000;Calderón, Norte De Quito;04/abril/2020;;;
Venta,Departamentos 3d, Conjunto Mont Blanc, Crédito Vip, En Sta.Mónica De Conocoto;Departamentos; 265000;Conocoto, Valle Los Chillos;03/abril/2020;;;
Suite De Venta Frente Al Megamaxi - Sector La Carolina;Departamentos; 93000;Iñaquito, Centro Norte;02/abril/2020;;;
Departamento 3 Dormitorios De Venta Sector El Bosque - Union Nacional. Centro Norte De Quito;Departamentos; 183660;Rumipamba, Centro Norte;02/abril/2020;;;
Vendo Hermosa Suite Amoblada (Quito Tennis);Departamentos; 125000;Rumipamba, Centro Norte;01/abril/2020;;;
Departamento En Venta A Estrenar 3 Dormitorios - Centro Norte - El Batán - Quito;Departamentos; 219239;Iñaquito, Centro Norte;01/abril/2020;;;
Hermosa Casa Moderna De Venta O Renta A Menor Precio Que El Constructor!;Casa; 415000;Tumbaco, Valle Tumbaco;01/abril/2020;;;
Vendo Casa De 120 M² Area Terreno De 960 M² Barrio La Joya 1;Casa; 85000;Quito;01/abril/2020;;;
Venta Casa, 3 Habitaciones, Armenia 2;Casa; 135000;La Armenia I, Conocoto, Valle Los Chillos;01/abril/2020;;;
Venta Casa Valle De Los Chillos Buen Precio;Casa; 75000;Quito;01/abril/2020;;;
Departamento En Venta, Espectacular Vista, Piscina, El Bosque;Departamentos; 295000;Cochapamba, Centro Norte;01/abril/2020;;;
Venta Departamento Miravalle 4;Departamentos; 175000;Miravalle, Nayon - Tanda, Valle Tumbaco;01/abril/2020;;;
Venta Departamento Centro Conocoto;Departamentos; 64500;Conocoto, Valle Los Chillos;01/abril/2020;;;
Vendo Lindo Departamento Ponceano Alto. 103m, 124999usd;Departamentos; 127999;Tumbaco, Valle Tumbaco;31/marzo/2020;;;
Vendo Casa Rentera Esquinera Kennedy 588 M²;Casa; 500000;Kennedy, Centro Norte;31/marzo/2020;;;
Volv009 De Oportunidad Hermosa Y Amplia Suite Amoblada En Venta, Exclusivo Sector De Guápulo.;Departamentos; 120000;Gonzalez Suarez, Iñaquito, Centro Norte;31/marzo/2020;;;
Casa En Venta, Sector La Armenia, Los Chillos, Cerca A La Autopista Gral. Rumiñahui, Sur De Quito;Casa; 399000;Conocoto, Valle Los Chillos;31/marzo/2020;;;
Vendo Departamentos A Estrenar De 2 Y 3 Dormitorios En El Sector De Mejor Plusvalía De Quito;Departamentos; 151795;Iñaquito, Centro Norte;30/marzo/2020;;;
Venta Casa Tumbaco, Las Peñas;Casa; 235000;Tumbaco, Valle Tumbaco;30/marzo/2020;;;
Acepto Canje Por Lote/Cebollar Cumbaya Vendo Magnifica Casa De Op0rtunidad En El Cebollar Cumbaya.Grande Vip;Casa; 350000;Cumbaya, Valle Tumbaco;30/marzo/2020;;;
Casa En Venta Sector Armenia II;Casa; 125000;Conocoto, Valle Los Chillos;30/marzo/2020;;;
Venta De 2 Casas Y Suite Y 3300 M2 De Terreno En Nayon.1;Casa; 1500000;Nayon - Tanda, Valle Tumbaco;29/marzo/2020;;;
Cambio O Vendo Hermosa Casa;Casa; 155000;San Isidro Del Inca, Centro Norte;29/marzo/2020;;;
Venta, Departamento Remodelado Norte De Quito, Carcelen;Casa; 68000;Ponceano, Norte De Quito;28/marzo/2020;;;
Vendo Casa Con Amplios Espacios, En Ciudadela Unión Nacional, Cerca A El Bosque;Casa; 290000;Rumipamba, Centro Norte;28/marzo/2020;;;
Pomasqui , Casa 120 Mts.2 Plantas Sin Acabados , Lindo Conjunto Privado, Piscina;Casa; 95000;Pomasqui, Norte De Quito;28/marzo/2020;;;
Propiedad Rentera 325 Mtrs El Inca( Sector Las Palmeras) Excelente Estado;Casa; 170000;Jipijapa, Centro Norte;28/marzo/2020;;;
Venta Departamento A Estrenar 3 Habitaciones Edificio Torre Ozla Con Ascensor Sector Hospital Docente "Calderón" $65.000;Departamentos; 65000;Calderón, Norte De Quito;27/marzo/2020;;;
Vendo Departamento Nuevo En Nayon Cod 107-16;Departamentos; 125000;Nayon - Tanda, Valle Tumbaco;27/marzo/2020;;;
Tanda Hermosa Casa Conjunto $237.000;Casa; 237000;Alangasí, Valle Los Chillos;27/marzo/2020;;;
Casas De Venta - Calderón - Conjunto Cerrado Con Psicina- A 300mts Colegio Escuela El Milenio - Si Aplica A Crédito Vip;Casa; 70990;Calderón, Norte De Quito;27/marzo/2020;;;
Hermosa Casa Por Estrenar En La Ciudadela Ibarra;Casa; 91000;La Ecuatoriana, Sur De Quito;26/marzo/2020;;;
Linda Casa De 3 Pisos En Conjunto Habitacional A 5 Minutos Del CC El Portal;Casa; 89990;Calderón, Norte De Quito;26/marzo/2020;;;
