NOMBRE_CONJUNTO;TIPO_BIEN;PRECIO;LOCALIZACIÓN;FECHA_PUBLICACIÓN;ÁREA m²;NUM_HABITACIONES;NOMBRE_PROYECTO
Miguel Angel;Penthouse; 320000;Cumbaya, Valle Tumbaco;06/abril/2020;;3;
Casa Venta;Casa; 150000;La Armenia I, Conocoto, Valle Los Chillos;18/febrero/2020;;;
Departamento De Venta O Alquiler;Departamentos; 60000;Conocoto, Valle Los Chillos;07/04/2020;;;
Me/Sector Quito Tenis Lindo Penthouse De Venta!!;Departamentos; 380000;Rumipamba, Centro Norte;07/04/2020;;;
Casa De Venta En Calderon, Carapungo, Vía Marianitas, Llano Grande, Chico , Ism Calderón;Casa; 68000;Calderón, Norte De Quito;06/abril/2020;;;
Venta De Departamento Dúplex De 126m² Granda Centeno, Quito;Departamentos; 179000;Granda Centeno, Rumipamba, Centro Norte;06/abril/2020;;;
Suite En Venta 70m2 Urbanización El Condado Edificio Nyon;Departamentos; 100266;El Condado, Norte De Quito;07/04/2020;;;
Vendo Casa 120 Mtrs, 3 Dormitorios, Sector Amagasí Del Inca;Casa; 115000;San Isidro Del Inca, Centro Norte;06/abril/2020;;;
Venta Departamento, Sector Mariana De Jesús, Citymed, Hospital Metropolitano, Parque De La Mujer, Colegio San Gabrielito;Departamentos; 117000;Rumipamba, Centro Norte;06/abril/2020;;;
Vendo Casa Mitad Del Mundo;Casa; 55000;San Antonio De Pichincha, Norte De Quito;06/abril/2020;;;
Se Vende, Departamento, Centro Norte Bulgaria;Departamentos; 170000;Iñaquito, Centro Norte;06/abril/2020;;;
Venta De Casas De Oportunidad En El Valle De Tumbaco Sector Tola Grande Cerca De La Ruta Viva E Interoceánica;Casa; 130000;Tumbaco, Valle Tumbaco;06/abril/2020;;;
Departamento De Venta Sector Monteserrin;Departamentos; 114500;Jipijapa, Centro Norte;05/abril/2020;;;
Vendo Linda Casa En Llano Grande Conjunto Con Cámaras De Seguridad;Casa; 52000;Calderón, Norte De Quito;05/abril/2020;;;
Vendo Departamento Sector La Católica;Departamentos; 125000;Mariscal Sucre, Centro Norte;04/abril/2020;;;
Cumbaya - Vendo Casa;Casa; 355000;Cumbaya, Valle Tumbaco;04/abril/2020;;;
Vendo Departamento De 2 Dormitorios Sector Collaloma;Departamentos; 55000;Comité Del Pueblo, Centro Norte;04/abril/2020;;;
Separe Con Solo 500 Su Casa, Departamento O Local Comercial!!;Casa; 89000;Calderón, Norte De Quito;04/abril/2020;;;
Departamento 3 Dormitorios De Venta Sector El Bosque - Union Nacional. Centro Norte De Quito;Departamentos; 183660;Rumipamba, Centro Norte;02/abril/2020;;;
Vendo Hermosa Suite Amoblada (Quito Tennis);Departamentos; 125000;Rumipamba, Centro Norte;01/abril/2020;;;
Hermosa Casa Moderna De Venta O Renta A Menor Precio Que El Constructor!;Casa; 415000;Tumbaco, Valle Tumbaco;01/abril/2020;;;
Vendo Casa De 120 M² Area Terreno De 960 M² Barrio La Joya 1;Casa; 85000;Quito;01/abril/2020;;;
Venta Casa, 3 Habitaciones, Armenia 2;Casa; 135000;La Armenia I, Conocoto, Valle Los Chillos;01/abril/2020;;;
Venta De Casa Grande Naciones Unidas En Conjunto Estilo Mediterraneo;Casa; 280000;Granda Centeno, Rumipamba, Centro Norte;01/abril/2020;;;
Venta Departamento Miravalle 4;Departamentos; 175000;Miravalle, Nayon - Tanda, Valle Tumbaco;01/abril/2020;;;
Venta Departamento Centro Conocoto;Departamentos; 64500;Conocoto, Valle Los Chillos;01/abril/2020;;;
Vendo Lindo Departamento Ponceano Alto. 103m, 124999usd;Departamentos; 127999;Tumbaco, Valle Tumbaco;31/marzo/2020;;;
Departamento Con Balcon 2 Dorm. Quito Tenis De Venta, Centro Norte Quito;Departamentos; 139000;Rumipamba, Centro Norte;31/marzo/2020;;;
Casa En Venta, Sector La Armenia, Los Chillos, Cerca A La Autopista Gral. Rumiñahui, Sur De Quito;Casa; 399000;Conocoto, Valle Los Chillos;31/marzo/2020;;;
Acepto Canje Por Lote/Cebollar Cumbaya Vendo Magnifica Casa De Op0rtunidad En El Cebollar Cumbaya.Grande Vip;Casa; 350000;Cumbaya, Valle Tumbaco;30/marzo/2020;;;
Cambio O Vendo Hermosa Casa;Casa; 155000;San Isidro Del Inca, Centro Norte;29/marzo/2020;;;
Vendo Casa Con Amplios Espacios, En Ciudadela Unión Nacional, Cerca A El Bosque;Casa; 290000;Rumipamba, Centro Norte;28/marzo/2020;;;
Venta Departamento A Estrenar 3 Habitaciones Edificio Torre Ozla Con Ascensor Sector Hospital Docente "Calderón" $65.000;Departamentos; 65000;Calderón, Norte De Quito;27/marzo/2020;;;
Tanda Hermosa Casa Conjunto $237.000;Casa; 237000;Alangasí, Valle Los Chillos;27/marzo/2020;;;
Bajo De Precio. Centro. Mojas. Urb. Jardin Del Valle.;Casa; 350000;Puengasí, Centro Colonial;27/marzo/2020;;;
Casas De Venta - Calderón - Conjunto Cerrado Con Psicina- A 300mts Colegio Escuela El Milenio - Si Aplica A Crédito Vip;Casa; 70990;Calderón, Norte De Quito;27/marzo/2020;;;
Hermosa Casa Por Estrenar En La Ciudadela Ibarra;Casa; 91000;La Ecuatoriana, Sur De Quito;26/marzo/2020;;;
Linda Casa De 3 Pisos En Conjunto Habitacional A 5 Minutos Del CC El Portal;Casa; 89990;Calderón, Norte De Quito;26/marzo/2020;;;
Departamento En Venta Sector Bellavista. Negociable;Departamentos; 289000;Iñaquito, Centro Norte;25/marzo/2020;;;
Quito Tennis, Duplex 4 Dormitorios.;Departamentos; 320000;Rumipamba, Centro Norte;24/marzo/2020;;;
Departamento De Venta, Sector El Bosque, Norte De Quito, Penthouse Con Hermosa Vista;Departamentos; 195000;Quito Tenis, Centro Norte;24/marzo/2020;;;
Casa De Oportunidad En Manta;Casa; 245000;Iñaquito, Centro Norte;24/marzo/2020;;;
En Venta Hermosa Casa Vip - Mitad Del Mundo;Casa; 70000;San Antonio De Pichincha, Norte De Quito;23/marzo/2020;;;
Venta De Espectacular Departamento Con 3 Dormitorios En Un Edificio Inteligente De 24 Pisos, Sector La Carolina.;Departamentos; 296423;Iñaquito, Centro Norte;23/marzo/2020;;;
Vendo Departamento En Conjunto Privado Solanda;Departamentos; 43000;Calderón, Norte De Quito;22/marzo/2020;;;
Lindo Proyecto De Casas La Morita Timbaco Vip;Casa; 89900;Tumbaco, Valle Tumbaco;21/marzo/2020;;;
Suite Venta De Oportunidad O Para Inversión, Santa Lucía;Departamentos; 60000;Kennedy, Centro Norte;21/marzo/2020;;;
Venta Casa En Conjunto San Juan - Cumbaya;Casa; 260000;Cumbaya, Valle Tumbaco;21/marzo/2020;;;
Casa De Venta Sur De Quito Ciudadela Del Ejército.;Casa; 99000;Quitumbe, Sur De Quito;21/marzo/2020;;;
Vendo Casa No Adosada - Conjunto - Viña Alta - Jardines;Casa; 199000;Tumbaco, Valle Tumbaco;20/marzo/2020;;;
Departamento Venta 3 Dormitorios Monteserrin.;Departamentos; 280000;Monteserrin, Jipijapa, Centro Norte;20/marzo/2020;;;
Apartamento De Tres Dormitorios;Departamentos; 60000;El Condado, Norte De Quito;20/marzo/2020;;;
Se Vende Casa En Conjunto Bosques De Inchalillo, Sangolqui;Casa; 138000;Mariscal Sucre, Centro Norte;20/marzo/2020;;;
Vendo Amplio Departamento - 3 Habitaciones - Cotocollao;Departamentos; 110000;Cochapamba, Centro Norte;19/marzo/2020;;;
Suite De Venta, Quito Tenis, Edificio Moen;Departamentos; 110000;Rumipamba, Centro Norte;19/marzo/2020;;;
Departamento Nuevo En Venta, Sector De El Condado 149 M2, 3 Habitaciones, Cuarto De Huéspedes, 3 Gar;Departamentos; 147000;El Condado, Norte De Quito;19/marzo/2020;;;
Vendo Linda Casa Esquinera Sector Pomasqui, Mitad Del Mundo;Casa; 75000;Pomasqui, Norte De Quito;18/marzo/2020;;;
Departamento 2 Dormitorios Sector Río Coca;Departamentos; 67000;El Inca, Jipijapa, Centro Norte;18/marzo/2020;;;
Venta Hermosa Casa Urbanización El Condado 314m2;Casa; 179000;Cotocollao, Norte De Quito;18/marzo/2020;;;
Vendo Departamento Con Amplio Jardín Privado, Sector Central;Departamentos; 165000;Rumipamba, Centro Norte;17/marzo/2020;;;
Vendo Departamento 2 Habitaciones, Eloy Alfaro, Av. Portugal, 6 De Diciembre, La Carolina;Departamentos; 110000;Iñaquito, Centro Norte;16/marzo/2020;;;
Vendo O Cambio Precioso Departamento Quito Tenis;Departamentos; 350000;Rumipamba, Centro Norte;16/marzo/2020;;;
Casa En Venta En Conjunto Sector Ponceano Alto;Casa; 124000;Ponceano, Norte De Quito;16/marzo/2020;;;
Departamento De Venta En Cumbaya, Urb. Jardines Del Este;Departamentos; 200000;Cumbaya, Valle Tumbaco;16/marzo/2020;;;
Departamento En Venta Portugal Cerca A Eloy Alfaro 4 Habitaciones, 2 Parqueaderos;Departamentos; 175000;Iñaquito, Centro Norte;16/marzo/2020;;;
Oportunidad De Venta Hermosa Casa Dentro De Excelente Zona Residencial De Miravalle;Casa; 489000;Miravalle, Nayon - Tanda, Valle Tumbaco;15/marzo/2020;;;
Oportunidad Departamento De Venta,Solo $31.000;Departamentos; 31000;Solanda, Sur De Quito;15/marzo/2020;;;
Venta Departamento Amagasi Del Inca (Conjunto Privado) Embajada Americana;Departamentos; 118000;San Isidro Del Inca, Centro Norte;15/marzo/2020;;;
Hermoso Departamento Amoblado De Venta - Sector Norte De Quito - Granados Y 6 De Diciembre;Departamentos; 88000;Jipijapa, Centro Norte;14/marzo/2020;;;
Vendo Departamento Tres Dormitorios Sector Batan Bajo;Departamentos; 140000;El Batan, Iñaquito, Centro Norte;14/marzo/2020;;;
Vendo Linda Casa Urb Los Cedros Carcelen;Casa; 410000;Carcelen, Norte De Quito;14/marzo/2020;;;
Venta Quinta El Quinche Terreno 7.500m2;Casa; 270000;El Quinche, Valle Tumbaco;13/marzo/2020;;;
Casa Rentera Con Local Comercial Sector Mercado Mayorista Sur De Quito;Casa; 150000;Solanda, Sur De Quito;13/marzo/2020;;;
Departamento De Venta En Quito Tenis Norte De Quito, El Bosque;Departamentos; 275000;Rumipamba, Centro Norte;13/marzo/2020;;;
Bellavista, Vendo Departamento 84 M², 2 Dorm.;Departamentos; 120000;Bellavista, Iñaquito, Centro Norte;13/marzo/2020;;;
Quito Tenis / El Bosque / Buenavista Departamento Venta, 176 M2, 3 Dormitorios, Balcón, Ascensor, Vista,Quito Norte;Departamentos; 240000;Rumipamba, Centro Norte;13/marzo/2020;;;
Vendo Hermosa Casa En La Rivera De La Armenia;Casa; 94999;Conocoto, Valle Los Chillos;12/marzo/2020;;;
Departamento De Venta 123,66m2 / $ 125000 - Sector La Mariscal;Departamentos; 125000;Mariscal Sucre, Centro Norte;12/marzo/2020;;;
El Batán - Suite En Venta Precio A Negociar;Departamentos; 87000;El Inca, Jipijapa, Centro Norte;12/marzo/2020;;;
Venta Casa Independiente, Sector Pinar Alto;Casa; 199000;El Pinar, Concepción, Centro Norte;11/marzo/2020;;;
Se Vende Casa 260m² 6 Hab /5 Baños /1 Local Anexo /Av Real Audiencia Quito Norte;Casa; 145000;Kennedy, Centro Norte;11/marzo/2020;;;
Vendo Departamento Duplex, Sector La Isla, Universidad Central, 198m2;Departamentos; 130000;Belisario Quevedo, Centro Norte;11/marzo/2020;;;
Casa En Venta;Casa; 45000;Conocoto, Valle Los Chillos;11/marzo/2020;;;
Up Vendo Departamento Lujo Bellavista 2 Dormitorios;Departamentos; 179000;Bellavista, Iñaquito, Centro Norte;11/marzo/2020;;;
Confortable Casa Esquinera De Venta En El Conde 1;Casa; 60000;Turubamba, Sur De Quito;10/marzo/2020;;;
Venta Departamento Cumbaya;Departamentos; 211855;Cumbaya, Valle Tumbaco;10/marzo/2020;;;
Casa En Venta En El Einstein, Conjunto Cerrado, 4 Habitaciones $;Casa; 156000;Carcelen, Norte De Quito;10/marzo/2020;;;
Venta De Casa De Oportunidad En San Sebastian Calderón II Etapa;Casa; 74000;Calderón, Norte De Quito;10/marzo/2020;;;
Oportunidad Hermosa Suite De Venta A Estrenar 0edificio Atellier U/S Precio Negociable;Departamentos; 137900;Iñaquito, Centro Norte;10/marzo/2020;;;
Casas Nuevas En Venta Dentro De Conjunto Privado En Capelo – Valle De Los Chillos – Sector Sangolquí Cerca De San Rafael;Casa; 85000;Quito;10/marzo/2020;;;
Ponceano Casa De Venta;Casa; 330000;Ponceano, Norte De Quito;10/marzo/2020;;;
Casa De Venta, Valle De Los Chillos, Sector San Rafael;Casa; 105000;Amaguaña, Sur De Quito;10/marzo/2020;;;
Norte -Condado Conjunto. Verde Horizonte, Casa De 3 Dormitorios Con Sala De Estar;Casa; 92000;El Condado, Norte De Quito;10/marzo/2020;;;
Venta De Casa Grande Rentera En Sur De Quito Sector San Diego Negociable;Casa; 140000;Centro De Quito, Centro Colonial;10/marzo/2020;;;
Venta Departamento 3 Dormitorios En Proyecto Sector República Del Salvador, Carolina, Batan, Centro Norte, Uio;Departamentos; 201527;Iñaquito, Centro Norte;10/marzo/2020;;;
Mirasierra-Valle De Los Chillos Departamento 3 Dormitorios Por Estrenar En Venta;Departamentos; 124272;Alangasí, Valle Los Chillos;10/marzo/2020;;;
Cumbaya, Moderna Suite De Venta En Urbanización Cerrada;Departamentos; 105500;Cumbaya, Valle Tumbaco;10/marzo/2020;;;
Amplio Departamento Entre La Gonzalez Suarez Y Bosmediano, 4 Dormitorios, Piscina, Raquet, Sauna, Turco, Hermosa Vista.;Departamentos; 230000;Bellavista, Iñaquito, Centro Norte;10/marzo/2020;;;
Hermosa Casa De Venta 3 Pisos Conjunto Entrepinos Sector Colegio Sek;Casa; 140000;San Isidro Del Inca, Centro Norte;10/marzo/2020;;;
Venta De Casa De Oportunidad En Quitumbe Sur De Quito;Casa; 59500;Quitumbe, Sur De Quito;10/marzo/2020;;;
Conjunto Cerrado Con Piscina E Hidromasaje - Casa En Calderon;Departamentos; 70990;Calderón, Norte De Quito;10/marzo/2020;;;
Bajo De Precio! Departamento Por Estrenar En Tumbaco;Departamentos; 150000;Tumbaco, Valle Tumbaco;10/marzo/2020;;;
En Venta Casa De Lujo Con Hermosa Vista Sector Pinar Alto Quito;Casa; 800000;El Pinar, Concepción, Centro Norte;10/marzo/2020;;;
Casa De Venta En Conjunto Cerrado - Pomasquí;Casa; 70000;Puéllaro, Norte De Quito;10/marzo/2020;;;
Casa Independiente Monjas Jardín Del Valle;Casa; 126000;Puengasí, Centro Colonial;10/marzo/2020;;;
Vendo Hermoso Departamento En Ponceano;Departamentos; 95000;Ponceano, Norte De Quito;10/marzo/2020;;;
Vendo Departamento;Departamentos; 148000;Belisario Quevedo, Centro Norte;10/marzo/2020;;;
Venta Casa Luluncoto, Chimbacalle;Casa; 64000;Puengasí, Centro Colonial;10/marzo/2020;;;
La Coruña, Sector La Paz, Casa En Conjunto;Casa; 210000;Iñaquito, Centro Norte;10/marzo/2020;;;
Venta De Quinta En La Merced Valle Los Chillos;Casa; 400000;La Merced, Valle Los Chillos;10/marzo/2020;;;
Vendo Casa De Campo Sector De Alangasí - Valle De Los Chillos;Casa; 189000;Alangasí, Valle Los Chillos;10/marzo/2020;;;
Casa De Venta, Rancho San Francisco, Cumbaya, Nayon;Casa; 210000;Nayon - Tanda, Valle Tumbaco;10/marzo/2020;;;
Vendo Hermoso Departamento 5to. Piso;Departamentos; 157000;Iñaquito, Centro Norte;10/marzo/2020;;;
Departamento El Bosque Quito;Departamentos; 160000;Quito Tenis, Centro Norte;10/marzo/2020;;;
Departamento Con Hermosa Vista;Departamentos; 190000;Bellavista, Iñaquito, Centro Norte;10/marzo/2020;;;
Vendo Casa 3. Apartamentos Uno De Un Dormitorio Uno De Dos. Dormitorios Y Otro De 3 Dormitorios;Casa; 170000;La Magdalena, Sur De Quito;10/marzo/2020;;;
Venta Departamento Cotocollao;Departamentos; 85000;Cochapamba, Centro Norte;10/marzo/2020;;;
Venta, Departamentos Entrega Inmediata;Departamentos; 70890;Calderón, Norte De Quito;10/marzo/2020;;;
Departamento De 3 Dormitorios Sector Gonzalez Suarez;Departamentos; 244869;Gonzalez Suarez, Iñaquito, Centro Norte;10/marzo/2020;;;
Bello Departamento De Venta Sector Bosque, Norte De Quito;Departamentos; 295000;Rumipamba, Centro Norte;10/marzo/2020;;;
Vendo Hermosas Casas A Estrenar Calderón;Casa; 78500;Calderón, Norte De Quito;10/marzo/2020;;;
La Pradera 118 M² Departamento 3 Dormitorios Maravilloso;Departamentos; 125000;Iñaquito, Centro Norte;10/marzo/2020;;;
Departamen 3 Dormitoris El Transito;Departamentos; 55000;El Condado, Norte De Quito;08/marzo/2020;;;
Vendo Casa Jardín, Nayón, Precio Especial Feria - Wasi;Casa; 169000;Nayon - Tanda, Valle Tumbaco;31/marzo/2020;;;
Campo Alegre 2;Casa; 650000;Monteserrin, Jipijapa, Centro Norte;31/marzo/2020;;;
306 - Casa De Venta En Capelo, Cerca San Rafael, San Luis Shopping, El Triángulo, Sangolquí;Casa; 285000;Quito;10/marzo/2020;;;
Casa, Urbanización Privada En Venta O Alquiler, Zona Rancho San Francisco, Tanda;Casa; 595000;Nayon - Tanda, Valle Tumbaco;20/marzo/2020;;;
Casa Venta;Casa; 292000;Cumbaya, Valle Tumbaco;16/marzo/2020;;;
Vendo Amplia Casa Rentera Con Local Comercial;Casa; 88000;Comité Del Pueblo, Centro Norte;10/marzo/2020;;;
Casa Venta;Casa; 540000
            $100 alicuota;Cumbaya, Valle Tumbaco;19/febrero/2020;;;
Casa Venta;Casa; 230000;Norte De Quito;25/marzo/2020;;;
Departamento De 3 Dormitorios En Colinas Del Pichincha;Departamentos; 260000;Rumipamba, Centro Norte;06/abril/2020;436;3;
Venta Casa De 305 M² Con Jardines Y Piscina. Tumbaco;Casa; 260000;Tumbaco, Valle Tumbaco;10/marzo/2020;;;
Vendo Suite De Oportunidad Sector Jipijapa;Departamentos; 68000;Jipijapa, Centro Norte;06/abril/2020;;;
Venta Departamento Orellana Y 12 De Octubre Edificio Jericó;Departamentos; 261000;Iñaquito, Centro Norte;14/marzo/2020;;;
Espectacular Penthouse Duplex En Venta Sector Gonzalez Suarez Centro Norte De Quito Isabel La Catolica Y Zaldumbide;Departamentos; 750000;Mariscal Sucre, Centro Norte;07/04/2020;;;
Cumbaya Departamento En Venta Por Estrenar En Urb. Privada;Departamentos; 730000;Cumbaya, Valle Tumbaco;05/abril/2020;;;
Casa De Venta, 4 Dormitorios, Sector Puembo, Conjunto Cerrado;Casa; 900000;Puembo, Valle Tumbaco;13/marzo/2020;;;
1pbcumbayá. La Primavera. Venta. Depart 108m 3dormitorios+Patio 74,33m;Departamentos; 183949;Cumbaya, Valle Tumbaco;04/abril/2020;;;
Departamento De Lujo Por Estrenar En La Av Coruña;Departamentos; 230238;Iñaquito, Centro Norte;03/abril/2020;;;
Casa De Venta En La Armenia, Cerca Al Parque Metropolitano;Casa; 160000;Conocoto, Valle Los Chillos;03/abril/2020;;;
Amplia Casa En Venta,Tres Habitaciones Con Baño Privado,Autopista General Rumiñahui;Casa; 135000;Conocoto, Valle Los Chillos;02/abril/2020;;;
Casa De Venta En Cumbaya, 4 Dormitorios, Un Dormitorio En Pb;Casa; 610000;Tumbaco, Valle Tumbaco;10/marzo/2020;;;
Batan Ana Luisa Vendo Oportunidad Departamento;Departamentos; 128000;El Batan, Iñaquito, Centro Norte;27/marzo/2020;;;
Vendo Departamentos En Calderón;Departamentos; 43990;Calderón, Norte De Quito;31/marzo/2020;;;
Venta De Casa Vip En Sangolqui;Casa; 69900;Quito;31/marzo/2020;;;
Vendo Departamento 3 Dormitorios Edificio De Lujo. Av. Orellana / Cerca Coruña / Norte De Quito;Departamentos; 130000;Mariscal Sucre, Centro Norte;22/marzo/2020;;;
En Venta Casas En Calderon Por Estrenar, 3 Dormitorios;Casa; 78500;Calderón, Norte De Quito;30/marzo/2020;;;
Acogedora Y Luminosa Suite - Centro Norte De Quito;Departamentos; 75000;Bellavista, Iñaquito, Centro Norte;30/marzo/2020;;;
Venta Suit Muy Iluminada 56m2 - Rep Salvador;Departamentos; 100000;Iñaquito, Centro Norte;30/marzo/2020;;;
Casa Rentera Centro Histórico, Usd150.000;Casa; 150000;San Juan, Centro Colonial;30/marzo/2020;;;
Vendo Elegante Suite En La Urb. Lomas De Monteserrin Cerca Del Parque;Departamentos; 99000;Jipijapa, Centro Norte;10/marzo/2020;;;
Venta Departamento Sector El Batán - 180 M2;Departamentos; 160000;Jipijapa, Centro Norte;29/marzo/2020;;;
Venta De Departamento, Sin Amoblar, Dos Habitaciones. Sector El Batán;Departamentos; 120000;El Batan, Iñaquito, Centro Norte;29/marzo/2020;;;
Venta Suit Inca;Departamentos; 70000;Iñaquito, Centro Norte;28/marzo/2020;;;
Oportunidad Casa De Venta La Armenia 3 Dormitorios;Casa; 112000;Conocoto, Valle Los Chillos;02/abril/2020;;;
Casa En Venta En La Armenia, Valle De Los Chillos;Casa; 94000;Conocoto, Valle Los Chillos;19/marzo/2020;;;
Venta Departamento, Centro Norte, Sector Udla Granados;Departamentos; 75000;La Argelia, Sur De Quito;27/marzo/2020;;;
Hermosa Quinta Sector Mirasierra;Casa; 2785000;Alangasí, Valle Los Chillos;27/marzo/2020;;;
Venta De Departamento En San Fernando;Departamentos; 75000;Quito Tenis, Centro Norte;21/marzo/2020;;;
Departamento De Venta En Quito Centro Norte Batan Alto Portugal Cod: V025;Departamentos; 149000;Iñaquito, Centro Norte;25/marzo/2020;;;
Venta De Casa (140m2). Valle De Los Chillos/San Pedro De Taboada;Casa; 130000;Conocoto, Valle Los Chillos;24/marzo/2020;;;
Vendo Casa En Tanda;Casa; 379000;San Isidro Del Inca, Centro Norte;23/marzo/2020;;;
Venta De Departamento, Diamond Miravalle, Cumbaya;Departamentos; 220000;Itchimbía, Centro Colonial;23/marzo/2020;;;
Venta Casa Norte De Quito Carcelén Conjunto Privado El Olivar 2;Casa; 85000;Carcelen, Norte De Quito;23/marzo/2020;;;
Casa En Venta Quito/ Mitad Del Mundo/ Norte De Quito;Casa; 149990;San Antonio De Pichincha, Norte De Quito;22/marzo/2020;;;
Puembo Casa Quinta De Venta Terreno 3.745 Metros;Casa; 845000;Puembo, Valle Tumbaco;27/marzo/2020;;;
Hermosa Casa En Venta Sector Ponceano / Norte De Quito;Casa; 124900;Ponceano, Norte De Quito;22/marzo/2020;;;
Casa De Venta, Sector Sangolqui, Cerca Univ. Espe;Casa; 87000;Quito;21/marzo/2020;;;
Departamento En Venta Republica Del Salvador;Departamentos; 135000;Iñaquito, Centro Norte;04/abril/2020;;;
Vendo Suite En La Avenida República Del Salvador Y Naciones Unidas;Departamentos; 74000;Iñaquito, Centro Norte;21/marzo/2020;;;
Vendo Casa La Pampa;Casa; 230000;Pomasqui, Norte De Quito;20/marzo/2020;;;
Iñaquito Alto, Exclusivo Departmento Centro Norte De Quito;Departamentos; 125000;Rumipamba, Centro Norte;18/marzo/2020;;;
Monteserrin Suite Lujo 80m2. De Venta;Departamentos; 99000;Cochapamba, Centro Norte;31/marzo/2020;;;
Oportunidad Inversión Suite República Del Salvador;Departamentos; 93900;Iñaquito, Centro Norte;18/marzo/2020;;;
Venta Deparatamento Av.America Y Villalengua;Departamentos; 260000;Rumipamba, Centro Norte;18/marzo/2020;;;
Últimos Departamento De 3 Dorm. Con Acabados De Primera Sector Tumbaco - Las Acasias;Departamentos; 122000;Tumbaco, Valle Tumbaco;17/marzo/2020;;;
Venta Departamento Planta Baja En Cumbaya Con Acceso Al Chaquiñan Cerca Del Cc: Scala Con Gimnasio/ Piscina/Cine;Departamentos; 159000;Cumbaya, Valle Tumbaco;16/marzo/2020;;;
Casa De Venta En La Mitad Del Mundo, Norte De Quito, Cerca A La Nueva Av. Simón Bolívar;Casa; 54000;San Antonio De Pichincha, Norte De Quito;13/marzo/2020;;;
Venta Departamento Centro Norte-Las Casas;Departamentos; 65000;Belisario Quevedo, Centro Norte;15/marzo/2020;;;
Cxc Venta Casa, Guamani Alto, Sur De Quito, Exp. 3495;Casa; 76900;Belisario Quevedo, Centro Norte;14/marzo/2020;;;
Departamento En Granda Centeno, 3 Dormitorios;Departamentos; 199000;Granda Centeno, Rumipamba, Centro Norte;13/marzo/2020;;;
Espectacular Casa En Venta, Yanazarapa;Casa; 569000;Cumbaya, Valle Tumbaco;10/marzo/2020;;;
Duplex Departamento Tumbaco Super Seguro;Departamentos; 172000;Tumbaco, Valle Tumbaco;12/marzo/2020;;;
San Miguel De Conocoto, Casa, 105 M2, 3 Habitaciones, 2 Baños, 2 Parqueaderos;Casa; 94900;Conocoto, Valle Los Chillos;10/marzo/2020;;;
Casa En Venta Sector Armenia II;Casa; 125000;Conocoto, Valle Los Chillos;30/marzo/2020;;;
Oportunidad De Inversión. Casa En Urb. Pampa Cod 105-8;Casa; 250000;Pomasqui, Norte De Quito;10/marzo/2020;;;
Departamento De Venta, Sector Monteserrín, Norte De Quito, La Udla, Barato, Vendo;Departamentos; 149000;Jipijapa, Centro Norte;10/marzo/2020;;;
Venta Casas Norte De Quito Calderón;Casa; 79500;Calderón, Norte De Quito;10/marzo/2020;;;
Casa De Venta Norte De Quito Calderon;Casa; 65000;Calderón, Norte De Quito;10/marzo/2020;;;
Venta De Departamento Dúplex A Estrenar Sector Real Audiencia;Departamentos; 107000;Ponceano, Norte De Quito;10/marzo/2020;;;
Espectacular Departamento 300 Mtrs, El Bosque, Edificio Con Piscina;Departamentos; 498000;Quito Tenis, Centro Norte;10/marzo/2020;;;
Venta Departamento Localizado En Gaspar;Departamentos; 98000;Bellavista, Iñaquito, Centro Norte;10/marzo/2020;;;
Vendo Casa Grande 423 M2 Sector Jipijapa;Casa; 258000;Jipijapa, Centro Norte;10/marzo/2020;;;
Venta Suite, Centro Norte Colon, Eloy Alfaro;Departamentos; 70000;Belisario Quevedo, Centro Norte;10/marzo/2020;;;
Departamento De 2 Habitaciones La Carolina;Departamentos; 123400;La Carolina, Iñaquito, Centro Norte;10/marzo/2020;;;
Departamento En Venta 273m2 Sector La Coruña;Departamentos; 370000;Gonzalez Suarez, Iñaquito, Centro Norte;10/marzo/2020;;;
Venta De Hotel En El Centro Historico .;Casa; 1200000;Itchimbía, Centro Colonial;10/marzo/2020;;;
Casa En Conjunto Sector La Armenia II;Casa; 120000;Conocoto, Valle Los Chillos;10/marzo/2020;;;
Casa De Venta Sector La Baker / Avenida Real Audiencia/ Antiguo Aeropuerto;Casa; 225000;La Merced, Valle Los Chillos;10/marzo/2020;;;
Vendo Departamento 3 Dormitorios - Ponceano;Departamentos; 105000;Ponceano, Norte De Quito;20/marzo/2020;;;
Loft Venta Cumbaya Oportunidad Moderno;Departamentos; 149000;Tumbaco, Valle Tumbaco;10/marzo/2020;;;
Vendo Departamento Colonial Sector San Juan;Departamentos; 65000;Iñaquito, Centro Norte;10/marzo/2020;;;
California Alta Vendo Casa Independiente Totalmente Remodelada Norte De Quito;Casa; 195000;San Isidro Del Inca, Centro Norte;10/marzo/2020;;;
Amplia Y Moderna Suite - Rumipampa- Edificio Seguro A Estrenar - 57,85m2- 88510;Departamentos; 88510;Iñaquito, Centro Norte;10/marzo/2020;;;
Venta Casa Rentera, Tres Departamentos Independientes, Tres Plantas, Sector Mariana De Jesús, Centro Norte De Quito;Casa; 250000;Belisario Quevedo, Centro Norte;10/marzo/2020;;;
Casa Tipo Hotel - Casa De Venta - 24 Cuartos - Sector Mariscal;Casa; 995000;Mariscal Sucre, Centro Norte;10/marzo/2020;;;
Departamento Venta Sector Embajada Americana;Departamentos; 65000;Kennedy, Centro Norte;10/marzo/2020;;;
Vendo Casa Dentro De Exclusivo Conjunto;Casa; 154500;San Isidro Del Inca, Centro Norte;10/marzo/2020;;;
Amplia Y Remodelada Casa En Venta En San Isidro 2- Miravalle;Casa; 480000;Miravalle, Nayon - Tanda, Valle Tumbaco;10/marzo/2020;;;
En Venta Casa 3 Dormitorios Tumbaco En Conjunto Privado Sector Santa Rosa;Casa; 140000;Cumbaya, Valle Tumbaco;10/marzo/2020;;;
Vendo Casa Eden Del Valle Autopista Los Chillos Antes Del Peaje;Casa; 68000;Puengasí, Centro Colonial;10/marzo/2020;;;
Venta Departamento Por Estrenar Sector González Suárez;Departamentos; 270000;Bellavista, Iñaquito, Centro Norte;10/marzo/2020;;;
Venta Departamento, Sector Pinar Bajo;Departamentos; 70000;Concepción, Centro Norte;01/abril/2020;;;
Vendo Casa A Estrenar De 135 M2 En Capelo (Dentro De Un Conjunto Privado);Casa; 130000;Quito;10/marzo/2020;;;
Casa De Venta En Fajardo;Casa; 119000;Quito;16/marzo/2020;;;
Venta Suite Sin Muebles 70m Sector República Del Salvador;Departamentos; 109000;Iñaquito, Centro Norte;10/marzo/2020;;;
